633|['KendallJenner', 'chrisbrown']|teamadidas efqsq angelkendallj archived expoi kylie
634|['chrisbrown', 'KendallJenner']|weirdness dmxab tcj stores xglqxs kendallandkylieforovs
635|['KendallJenner', 'kourtneykardash']|tickets fccn obfkit agi gagjixzo njbbhqj
636|['KendallJenner', 'chrisbrown']|poamkiroy light refreshing start day kjbeczfblm
637|['chrisbrown', 'KendallJenner']|agi angelkendallj archived weirdness dmxab tcj
638|['chrisbrown', 'KendallJenner']|ukeehy tcu wvs kkszkazhfd kfwnizyunp archived
639|['chrisbrown', 'KendallJenner']|kardashianukfan kendall horses kardashianukfan kendall horses
640|['chrisbrown', 'KendallJenner']|kffiunh kendallandkylieforovs wzyq bxhiq nav xglqxs
641|['chrisbrown', 'KendallJenner']|archived kkszkazhfd expoi enjoy weirdness dmxab
642|['chrisbrown', 'KendallJenner']|kffiunh ovspeople stores xglqxs kendallandkylieforovs wzyq
643|['KendallJenner', 'chrisbrown']|kendall kylie select ovspeople stores xglqxs
644|['chrisbrown', 'khloekardashian']|enjoy weirdness dmxab tcj gyrcss nav
645|['chrisbrown', 'KendallJenner']|kelleybakerbrow actual brow queen jmyfkurh mpppg
646|['KendallJenner', 'chrisbrown']|fccn obfkit agi mhiiddeolq kendall kylie
647|['KendallJenner', 'chrisbrown']|select ovspeople stores xglqxs kendallandkylieforovs wzyq
648|['KendallJenner', 'chrisbrown']|kardashianukfan kendall horses archived agi kfwnizyunp
649|['KendallJenner', 'chrisbrown']|weirdness dmxab tcj oxd mhiiddeolq ovspeople
650|['KendallJenner', 'chrisbrown']|tune gagjixzo njbbhqj obfkit agi uabum
651|['KendallJenner', 'chrisbrown']|select ovspeople stores xglqxs kendallandkylieforovs wzyq
652|['KendallJenner', 'chrisbrown']|kendallandkylieforovs wzyq bxhiq nhb joynerlucas jbeex
653|['KendallJenner', 'chrisbrown']|mhiiddeolq njbbhqj enjoy weirdness dmxab tcj
654|['KendallJenner', 'chrisbrown']|mhiiddeolq wvs kkszkazhfd heartbreakonafullmoontour tickets fccn
655|['chrisbrown', 'BarackObama']|tickets fccn obfkit agi agi wzyq
656|['chrisbrown', 'KendallJenner']|voices calling change odds kids hmk
657|['KendallJenner', 'chrisbrown']|xglqxs kendallandkylieforovs wzyq bxhiq ukeehy tcu
658|['KendallJenner', 'chrisbrown']|oxd enjoy weirdness dmxab tcj wzyq
659|['KendallJenner', 'chrisbrown']|tcu fccn obfkit agi ovspeople stores
660|['KendallJenner', 'chrisbrown']|kendallandkylieforovs wzyq bxhiq njbbhqj heartbreakonafullmoontour tickets
661|['chrisbrown', 'FoxNews']|wzyq bxhiq rhaxgpwsft tcj heartbreakonafullmoontour tickets
662|['chrisbrown', 'KendallJenner']|reason representatives world protect american interests
663|['KendallJenner', 'BigSean']|uabum oxd rhaxgpwsft dmxab tcj kendalljexnner
664|['KendallJenner', 'chrisbrown']|voelt gagjixzo njbbhqj gagjixzo njbbhqj wooo
665|['KendallJenner', 'chrisbrown']|kendallandkylieforovs wzyq bxhiq horses heartbreakonafullmoontour tickets
666|['KendallJenner', 'chrisbrown']|uabum oxd agi joynerlucas jbeex gyrcss
667|['KendallJenner', 'chrisbrown']|tickets fccn obfkit agi kendallandkylieforovs wzyq
668|['chrisbrown', 'KylieJenner']|expoi select ovspeople stores xglqxs kendallandkylieforovs
669|['chrisbrown', 'KendallJenner']|pgsycwvmus fccn obfkit agi uygxjx dont
670|['KendallJenner', 'katyperry']|joynerlucas jbeex kfwnizyunp tcj mhiiddeolq ovspeople
671|['katyperry', 'SHAQ']|shoes qco kjvyw letting finding hakuna
672|['katyperry', 'KendallJenner']|opzah eejrp bmdm kawhi san antonio
673|['KendallJenner', 'chrisbrown']|prince today happy dopey sleepy week
674|['KendallJenner', 'chrisbrown']|jbeex die thoughts kffiunh kendalljexnner wooo
675|['KendallJenner', 'chrisbrown']|ukeehy tcu ukeehy tcu stores xglqxs
676|['KendallJenner', 'chrisbrown']|ovspeople stores xglqxs kendallandkylieforovs wzyq bxhiq
677|['chrisbrown', 'KimKardashian']|die thoughts kffiunh dmxab tcj kffiunh
678|['chrisbrown', 'KendallJenner']|die thoughts kffiunh jbeex heartbreakonafullmoontour tickets
679|['KendallJenner', 'chrisbrown']|enjoy weirdness dmxab tcj kkszkazhfd iiqwhhpyqj
680|['KendallJenner', 'chrisbrown']|wzyq bxhiq kendalljexnner wooo obfkit agi
681|['KendallJenner', 'chrisbrown']|kffiunh kendallandkylieforovs wzyq bxhiq wvs kkszkazhfd
682|['KendallJenner', 'chrisbrown']|ready rhaxgpwsft xglqxs kendallandkylieforovs wzyq bxhiq
683|['chrisbrown', 'camerondallas']|kkszkazhfd select ovspeople stores xglqxs kendallandkylieforovs
684|['chrisbrown', 'KendallJenner']|insta tickets fccn obfkit agi made
685|['chrisbrown', 'KendallJenner']|horses archived ukeehy tcu heartbreakonafullmoontour tickets
686|['KendallJenner', 'ObamaWhiteHouse']|kffiunh kffiunh ready rhaxgpwsft thoughts kffiunh
687|['KendallJenner', 'chrisbrown']|wooo made progress ensuring created equal
688|['chrisbrown', 'KendallJenner']|weirdness dmxab tcj obfkit agi horses
689|['KendallJenner', 'chrisbrown']|wooo kendall kylie select ovspeople stores
690|['chrisbrown', 'LilTunechi']|rhaxgpwsft idontdie joynerlucas jbeex expoi tickets
691|['chrisbrown', 'KendallJenner']|kontinue celebration youngmoneyapaa bqc tickets fccn
692|['chrisbrown', 'KendallJenner']|kendalljexnner wooo mpppg angelkendallj archived wvs
693|['chrisbrown', 'KendallJenner']|enjoy weirdness dmxab tcj joynerlucas jbeex
694|['chrisbrown', 'KendallJenner']|tcu kendall kylie select ovspeople stores
695|['KendallJenner', 'chrisbrown']|weirdness dmxab tcj kfwnizyunp xglqxs kendallandkylieforovs
696|['chrisbrown', 'tomhanks']|njbbhqj nhb gagjixzo njbbhqj rhaxgpwsft weirdness
697|['tomhanks', 'aliciakeys']|heartbreakonafullmoontour tickets fccn obfkit agi license
698|['tomhanks', 'chrisbrown']|hanx hlzapodyja april magic numbers hanx
699|['chrisbrown', 'KendallJenner']|row kevin turk tomhanksday lifeline energy
700|['KendallJenner', 'HillaryClinton']|fccn obfkit agi rhaxgpwsft archived horses
701|['KendallJenner', 'chrisbrown']|dmxab tcj heading nyc onwardtogether annual
702|['chrisbrown', 'KendallJenner']|die thoughts kffiunh ovspeople stores xglqxs
703|['chrisbrown', 'KendallJenner']|idontdie joynerlucas jbeex mpppg tickets fccn
704|['chrisbrown', 'KendallJenner']|ready rhaxgpwsft horses kffiunh tickets fccn
705|['chrisbrown', 'KendallJenner']|heartbreakonafullmoontour tickets fccn obfkit agi rhaxgpwsft
706|['KendallJenner', 'blakeshelton']|kffiunh archived kendall kylie select ovspeople
707|['KendallJenner', 'chrisbrown']|hope great rvrrpy lrf enjoy weirdness
708|['chrisbrown', 'KendallJenner']|dont die thoughts kffiunh weirdness dmxab
709|['chrisbrown', 'KendallJenner']|wvs kkszkazhfd njbbhqj wvs kkszkazhfd iiqwhhpyqj
710|['KendallJenner', 'Usher']|kendallandkylieforovs wzyq bxhiq enjoy weirdness dmxab
711|['KendallJenner', 'chrisbrown']|tidalxeji concertforjustice snbrxsr justice oapin rimi
712|['chrisbrown', 'KendallJenner']|die thoughts kffiunh iiqwhhpyqj uabum oxd
713|['KendallJenner', 'justinbieber']|archived mhiiddeolq wvs kkszkazhfd agi heartbreakonafullmoontour
714|['KendallJenner', 'chrisbrown']|hard facereality poobear jayelectronica ixmbzofnir bynbghqe
715|['chrisbrown', 'khloekardashian']|xglqxs kendallandkylieforovs wzyq bxhiq wzyq bxhiq
716|['chrisbrown', 'KendallJenner']|utrze yint utrze thoughts kffiunh die
717|['chrisbrown', 'KendallJenner']|dont die thoughts kffiunh kendall kylie
718|['chrisbrown', 'KendallJenner']|kkszkazhfd kylie select ovspeople stores xglqxs
719|['chrisbrown', 'KendallJenner']|obfkit agi uabum oxd kendallandkylieforovs wzyq
720|['chrisbrown', 'KendallJenner']|tickets fccn obfkit agi xglqxs kendallandkylieforovs
721|['chrisbrown', 'KendallJenner']|tickets fccn obfkit agi nhb idontdie
722|['chrisbrown', 'KendallJenner']|nhb fccn obfkit agi kendallandkylieforovs wzyq
723|['chrisbrown', 'KendallJenner']|wvs kkszkazhfd wvs kkszkazhfd nhb fccn
724|['chrisbrown', 'KendallJenner']|kardashianukfan kendall horses rhaxgpwsft fccn obfkit
725|['chrisbrown', 'KendallJenner']|njbbhqj die thoughts kffiunh kfwnizyunp kkszkazhfd
726|['chrisbrown', 'KendallJenner']|uabum oxd dont die thoughts kffiunh
727|['chrisbrown', 'KendallJenner']|heartbreakonafullmoontour tickets fccn obfkit agi bxhiq
728|['KendallJenner', 'Beyonce']|horses yup expoi joynerlucas jbeex tcu
729|['KendallJenner', 'chrisbrown']|starts rhqwqvls iwashere whd iwashere wzbads
730|['chrisbrown', 'KendallJenner']|stores xglqxs kendallandkylieforovs wzyq bxhiq stores
731|['chrisbrown', 'KendallJenner']|gagjixzo njbbhqj kendallandkylieforovs wzyq bxhiq tcu
732|['KendallJenner', 'SHAQ']|kendallandkylieforovs wzyq bxhiq dont die thoughts
733|['SHAQ', 'kanyewest']|uabum oxd ovspeople stores xglqxs kendallandkylieforovs
734|['SHAQ', 'chrisbrown']|race issues update conversation support sagerstrong
735|['chrisbrown', 'Beyonce']|iiqwhhpyqj rhaxgpwsft antonio week shaqcast kwlk
736|['chrisbrown', 'KendallJenner']|jbeex water children zxxnotfq beygood burundi
737|['chrisbrown', 'KendallJenner']|tickets fccn obfkit agi weirdness dmxab
738|['chrisbrown', 'KendallJenner']|obfkit agi bxhiq die thoughts kffiunh
739|['KendallJenner', 'LilTunechi']|kendalljexnner wooo mhiiddeolq angelkendallj archived ukeehy
740|['LilTunechi', 'maroon5']|kendalljexnner wooo mine pop fam time
741|['LilTunechi', 'chrisbrown']|follow bumbu instagram page tag friends
742|['chrisbrown', 'KendallJenner']|tonight kontinue celebration youngmoneyapaa bqc tapjkyj
743|['chrisbrown', 'KendallJenner']|mhiiddeolq kendall kylie select ovspeople stores
744|['chrisbrown', 'KendallJenner']|stores xglqxs kendallandkylieforovs wzyq bxhiq nav
745|['chrisbrown', 'KendallJenner']|agi gagjixzo njbbhqj rhaxgpwsft weirdness dmxab
746|['KendallJenner', 'ConanOBrien']|mhiiddeolq ready rhaxgpwsft kendall kylie select
747|['KendallJenner', 'chrisbrown']|hours drymouth risk erections select ovspeople
748|['chrisbrown', 'KendallJenner']|heartbreakonafullmoontour tickets fccn obfkit agi fccn
749|['chrisbrown', 'KendallJenner']|oxd wzyq bxhiq bxhiq heartbreakonafullmoontour tickets
750|['chrisbrown', 'KendallJenner']|tcu tcj tcj dont die thoughts
751|['chrisbrown', 'KendallJenner']|joynerlucas jbeex weirdness dmxab tcj mhiiddeolq
752|['chrisbrown', 'KendallJenner']|ovspeople stores xglqxs kendallandkylieforovs wzyq bxhiq
753|['chrisbrown', 'KendallJenner']|mhiiddeolq rhaxgpwsft ukeehy tcu heartbreakonafullmoontour tickets
754|['chrisbrown', 'KendallJenner']|tickets fccn obfkit agi oxd nhb
755|['chrisbrown', 'KendallJenner']|fccn obfkit agi nav wvs kkszkazhfd
756|['chrisbrown', 'KendallJenner']|obfkit agi gagjixzo njbbhqj dont die
757|['KendallJenner', 'Eminem']|yup expoi mhiiddeolq kylie select ovspeople
758|['KendallJenner', 'chrisbrown']|couple weekends coachella bandana coach lla
759|['chrisbrown', 'KendallJenner']|mhiiddeolq expoi wooo oxd kylie select
760|['chrisbrown', 'KendallJenner']|nav jbeex nhb enjoy weirdness dmxab
761|['chrisbrown', 'KendallJenner']|gagjixzo njbbhqj wvs kkszkazhfd agi heartbreakonafullmoontour
762|['chrisbrown', 'KendallJenner']|kendalljexnner wooo fccn obfkit agi wzyq
763|['chrisbrown', 'KendallJenner']|kendall kylie select ovspeople stores xglqxs
764|['chrisbrown', 'KendallJenner']|expoi obfkit agi tickets fccn obfkit
765|['chrisbrown', 'KendallJenner']|ukeehy tcu idontdie joynerlucas jbeex dont
766|['chrisbrown', 'KendallJenner']|idontdie joynerlucas jbeex ukeehy tcu angelkendallj
767|['chrisbrown', 'KendallJenner']|kendall kylie select ovspeople stores xglqxs
768|['chrisbrown', 'KendallJenner']|gyrcss nav stores xglqxs kendallandkylieforovs wzyq
769|['chrisbrown', 'KendallJenner']|kffiunh joynerlucas jbeex ready rhaxgpwsft wvs
770|['chrisbrown', 'KendallJenner']|nav kffiunh uabum oxd idontdie joynerlucas
771|['KendallJenner', 'SnoopDogg']|gyrcss nav enjoy weirdness dmxab tcj
772|['KendallJenner', 'chrisbrown']|luv dawgs wit kase single wwids
773|['chrisbrown', 'KendallJenner']|iiqwhhpyqj expoi nhb heartbreakonafullmoontour tickets fccn
774|['chrisbrown', 'KendallJenner']|mhiiddeolq dmxab tcj dont die thoughts
775|['chrisbrown', 'KendallJenner']|fccn obfkit agi fccn obfkit agi
776|['chrisbrown', 'KendallJenner']|tune gagjixzo njbbhqj dont die thoughts
777|['chrisbrown', 'KendallJenner']|stores xglqxs kendallandkylieforovs wzyq bxhiq rhaxgpwsft
778|['KendallJenner', 'maroon5']|wooo weirdness dmxab tcj tickets fccn
779|['KendallJenner', 'chrisbrown']|horses angelkendallj archived kendall kylie select
780|['chrisbrown', 'KendallJenner']|kfwnizyunp wzyq bxhiq jbeex angelkendallj archived
781|['KendallJenner', 'ashleytisdale']|ukeehy tcu agi mhiiddeolq uabum oxd
782|['KendallJenner', 'chrisbrown']|kylienep stuff works sold kzuafvrbn kfwnizyunp
783|['chrisbrown', 'RyanSeacrest']|fccn obfkit agi kardashianukfan kendall horses
784|['chrisbrown', 'KendallJenner']|show kellyripa gelmanlive producers viewers welcoming
785|['chrisbrown', 'KendallJenner']|kendall kylie select ovspeople stores xglqxs
786|['KendallJenner', 'camerondallas']|gyrcss nav gagjixzo njbbhqj xglqxs kendallandkylieforovs
787|['camerondallas', 'Oprah']|heart nav expoi dude history made
788|['Oprah', 'britneyspears']|ahh things talk podcast monday lgygbsva
789|['Oprah', 'chrisbrown']|skate park mvzg happy birthday big
790|['chrisbrown', 'KendallJenner']|natgeo ims ahh supersoul conversation streams
791|['chrisbrown', 'KendallJenner']|kffiunh ukeehy tcu tcu obfkit agi
792|['chrisbrown', 'KendallJenner']|oxd die thoughts kffiunh yup expoi
793|['chrisbrown', 'KendallJenner']|kendall kylie select ovspeople stores xglqxs
794|['chrisbrown', 'KendallJenner']|iiqwhhpyqj select ovspeople stores xglqxs kendallandkylieforovs
795|['chrisbrown', 'KendallJenner']|ovspeople stores xglqxs kendallandkylieforovs wzyq bxhiq
796|['chrisbrown', 'KendallJenner']|bxhiq ovspeople stores xglqxs kendallandkylieforovs wzyq
797|['KendallJenner', 'pitbull']|iiqwhhpyqj xglqxs kendallandkylieforovs wzyq bxhiq expoi
798|['KendallJenner', 'chrisbrown']|vegas time lives starts tonight zappostheater
799|['chrisbrown', 'KendallJenner']|thoughts kffiunh obfkit agi weirdness dmxab
800|['KendallJenner', 'KimKardashian']|nhb thoughts kffiunh iiqwhhpyqj kendalljexnner wooo
801|['KimKardashian', 'justinbieber']|yup expoi kendall kylie select ovspeople
802|['justinbieber', 'chrisbrown']|postmalone album yic xuk gxdd shiny
803|['chrisbrown', 'KendallJenner']|nhb die thoughts kffiunh die thoughts
804|['KendallJenner', 'BrunoMars']|mhiiddeolq kardashianukfan kendall horses jbeex rhaxgpwsft
805|['KendallJenner', 'chrisbrown']|gagjixzo njbbhqj enjoy weirdness dmxab tcj
806|['chrisbrown', 'KendallJenner']|kendallandkylieforovs wzyq bxhiq ovspeople stores xglqxs
807|['chrisbrown', 'KendallJenner']|thoughts kffiunh ready rhaxgpwsft enjoy weirdness
808|['chrisbrown', 'KendallJenner']|mhiiddeolq oxd wvs kkszkazhfd angelkendallj archived
809|['chrisbrown', 'KendallJenner']|agi stores xglqxs kendallandkylieforovs wzyq bxhiq
810|['chrisbrown', 'KendallJenner']|tune gagjixzo njbbhqj yup expoi agi
811|['chrisbrown', 'KendallJenner']|horses joynerlucas jbeex wooo expoi die
812|['chrisbrown', 'KendallJenner']|fccn obfkit agi mpppg xglqxs kendallandkylieforovs
813|['chrisbrown', 'KendallJenner']|idontdie joynerlucas jbeex gagjixzo njbbhqj kardashianukfan
814|['chrisbrown', 'KendallJenner']|weirdness dmxab tcj ready rhaxgpwsft enjoy
815|['chrisbrown', 'KendallJenner']|xglqxs kendallandkylieforovs wzyq bxhiq thoughts kffiunh
816|['chrisbrown', 'KendallJenner']|joynerlucas jbeex idontdie joynerlucas jbeex weirdness
817|['chrisbrown', 'KendallJenner']|stores xglqxs kendallandkylieforovs wzyq bxhiq heartbreakonafullmoontour
818|['chrisbrown', 'KendallJenner']|expoi jbeex archived heartbreakonafullmoontour tickets fccn
819|['chrisbrown', 'KendallJenner']|gyrcss nav kffiunh mhiiddeolq ready rhaxgpwsft
820|['chrisbrown', 'KendallJenner']|yup expoi kendall kylie select ovspeople
821|['chrisbrown', 'KendallJenner']|mpppg uabum oxd die thoughts kffiunh
822|['chrisbrown', 'KendallJenner']|kylie select ovspeople stores xglqxs kendallandkylieforovs
823|['chrisbrown', 'KendallJenner']|wooo rhaxgpwsft ukeehy tcu yup expoi
824|['chrisbrown', 'KendallJenner']|rhaxgpwsft wzyq bxhiq iiqwhhpyqj weirdness dmxab
825|['KendallJenner', 'SethMacFarlane']|nhb kylie select ovspeople stores xglqxs
826|['KendallJenner', 'chrisbrown']|thousand fucking blogs pieces criticisms analyses
827|['chrisbrown', 'KendallJenner']|ukeehy tcu heartbreakonafullmoontour tickets fccn obfkit
828|['chrisbrown', 'KendallJenner']|ovspeople stores xglqxs kendallandkylieforovs wzyq bxhiq
829|['chrisbrown', 'KendallJenner']|kkszkazhfd tickets fccn obfkit agi rhaxgpwsft
830|['KendallJenner', 'aplusk']|kendallandkylieforovs wzyq bxhiq yup expoi idontdie
831|['KendallJenner', 'chrisbrown']|issue educate wggnyub wggnyub sell cvcs
832|['chrisbrown', 'voguemagazine']|obfkit agi kffiunh ready rhaxgpwsft stores
833|['chrisbrown', 'KendallJenner']|actress complex heart wrenching netflix show
834|['chrisbrown', 'KendallJenner']|kendall kylie select ovspeople stores xglqxs
835|['chrisbrown', 'KendallJenner']|die thoughts kffiunh njbbhqj nav horses
836|['chrisbrown', 'KendallJenner']|idontdie joynerlucas jbeex die thoughts kffiunh
837|['chrisbrown', 'KendallJenner']|kardashianukfan kendall horses wvs kkszkazhfd dont
838|['KendallJenner', 'chrisbrown']|idontdie joynerlucas jbeex tcu wooo horses
839|['chrisbrown', 'KendallJenner']|mpppg uabum oxd rhaxgpwsft wvs kkszkazhfd
840|['chrisbrown', 'KendallJenner']|ukeehy tcu kkszkazhfd gyrcss nav angelkendallj
841|['KendallJenner', 'SportsCenter']|expoi kkszkazhfd gyrcss nav iiqwhhpyqj kendalljexnner
842|['KendallJenner', 'chrisbrown']|thriving retirement tied lead amateur golf
843|['chrisbrown', 'NICKIMINAJ']|kfwnizyunp horses kfwnizyunp rhaxgpwsft fccn obfkit
844|['chrisbrown', 'KendallJenner']|awwwwwww yyv fccn obfkit agi tcu
845|['chrisbrown', 'KendallJenner']|heartbreakonafullmoontour tickets fccn obfkit agi xglqxs
846|['chrisbrown', 'KendallJenner']|rhaxgpwsft die thoughts kffiunh heartbreakonafullmoontour tickets
847|['chrisbrown', 'KendallJenner']|kfwnizyunp tune gagjixzo njbbhqj rhaxgpwsft die
848|['chrisbrown', 'KendallJenner']|tcu wooo wvs kkszkazhfd mpppg gagjixzo
849|['chrisbrown', 'KendallJenner']|dont die thoughts kffiunh kendallandkylieforovs wzyq
850|['chrisbrown', 'KendallJenner']|kendallandkylieforovs wzyq bxhiq expoi enjoy weirdness
851|['chrisbrown', 'KendallJenner']|kardashianukfan kendall horses tcu ovspeople stores
852|['chrisbrown', 'KendallJenner']|tcj kendall kylie select ovspeople stores
853|['chrisbrown', 'KendallJenner']|oxd tickets fccn obfkit agi heartbreakonafullmoontour
854|['chrisbrown', 'KendallJenner']|mhiiddeolq kendallandkylieforovs wzyq bxhiq kendallandkylieforovs wzyq
855|['chrisbrown', 'KendallJenner']|kylie select ovspeople stores xglqxs kendallandkylieforovs
856|['chrisbrown', 'KendallJenner']|gyrcss nav tickets fccn obfkit agi
857|['chrisbrown', 'KendallJenner']|expoi horses uabum oxd uabum oxd
858|['KendallJenner', 'kanyewest']|wvs kkszkazhfd wooo wvs kkszkazhfd kffiunh
859|['KendallJenner', 'chrisbrown']|brought years point mentally imprisoned years
860|['chrisbrown', 'KendallJenner']|tcu archived tcu weirdness dmxab tcj
861|['chrisbrown', 'KendallJenner']|expoi kkszkazhfd archived uabum oxd wvs
862|['chrisbrown', 'KendallJenner']|njbbhqj dmxab tcj fccn obfkit agi
863|['chrisbrown', 'KendallJenner']|kardashianukfan kendall horses angelkendallj archived kendallandkylieforovs
864|['chrisbrown', 'KendallJenner']|kylie select ovspeople stores xglqxs kendallandkylieforovs
865|['chrisbrown', 'KendallJenner']|expoi tcj ovspeople stores xglqxs kendallandkylieforovs
866|['chrisbrown', 'KendallJenner']|ovspeople stores xglqxs kendallandkylieforovs wzyq bxhiq
867|['chrisbrown', 'KendallJenner']|kardashianukfan kendall horses kendalljexnner wooo gagjixzo
868|['KendallJenner', 'ladygaga']|idontdie joynerlucas jbeex yup expoi wzyq
869|['KendallJenner', 'chrisbrown']|xnqddaeo hirsch erasing stigma leadership award
870|['chrisbrown', 'KendallJenner']|mhiiddeolq gyrcss nav bxhiq kendall kylie
871|['KendallJenner', 'StephenAtHome']|kylie select ovspeople stores xglqxs kendallandkylieforovs
872|['StephenAtHome', 'ABC']|showing dating feature showing dating feature
873|['ABC', 'chrisbrown']|trump participates swearing ceremony sec state
874|['chrisbrown', 'KendallJenner']|encouraging yzdc vmrxg watch live pres
875|['chrisbrown', 'KendallJenner']|obfkit agi enjoy weirdness dmxab tcj
876|['KendallJenner', 'JimCarrey']|kfwnizyunp joynerlucas jbeex mpppg kardashianukfan kendall
877|['KendallJenner', 'chrisbrown']|macron suffer planet safe racuwdy intentions
878|['chrisbrown', 'KendallJenner']|thoughts kffiunh yup expoi nav uabum
879|['chrisbrown', 'KendallJenner']|wzyq bxhiq dmxab tcj wvs kkszkazhfd
880|['chrisbrown', 'KendallJenner']|wvs kkszkazhfd idontdie joynerlucas jbeex xglqxs
881|['chrisbrown', 'KendallJenner']|fccn obfkit agi kardashianukfan kendall horses
882|['chrisbrown', 'KendallJenner']|kendall kylie select ovspeople stores xglqxs
883|['chrisbrown', 'KendallJenner']|archived enjoy weirdness dmxab tcj gagjixzo
884|['chrisbrown', 'KendallJenner']|tickets fccn obfkit agi njbbhqj idontdie
885|['KendallJenner', 'funnyordie']|heartbreakonafullmoontour tickets fccn obfkit agi iiqwhhpyqj
886|['KendallJenner', 'chrisbrown']|yup expoi war times row reviews
887|['chrisbrown', 'KendallJenner']|dont die thoughts kffiunh ovspeople stores
888|['chrisbrown', 'KendallJenner']|mpppg angelkendallj archived tcj ready rhaxgpwsft
889|['chrisbrown', 'KendallJenner']|kendallandkylieforovs wzyq bxhiq kardashianukfan kendall horses
890|['chrisbrown', 'KendallJenner']|angelkendallj archived xglqxs kendallandkylieforovs wzyq bxhiq
891|['KendallJenner', 'KDTrey5']|wvs kkszkazhfd iiqwhhpyqj wzyq bxhiq thoughts
892|['KendallJenner', 'chrisbrown']|horses home win night dubnation bringing
893|['chrisbrown', 'ActuallyNPH']|kendall kylie select ovspeople stores xglqxs
894|['ActuallyNPH', 'Eminem']|amazing year mother send legit recommendations
895|['Eminem', 'chrisbrown']|family times thrived multiple presidential bubbles
896|['chrisbrown', 'KendallJenner']|hfnfhc jessie selfie sxsuypsefg live dates
897|['chrisbrown', 'KendallJenner']|yup expoi kendall kylie select ovspeople
898|['chrisbrown', 'KendallJenner']|mhiiddeolq tcu mhiiddeolq weirdness dmxab tcj
899|['chrisbrown', 'KendallJenner']|dmxab tcj expoi wvs kkszkazhfd ukeehy
900|['KendallJenner', 'KingJames']|select ovspeople stores xglqxs kendallandkylieforovs wzyq
901|['KendallJenner', 'chrisbrown']|angelkendallj archived kardashianukfan kendall horses angelkendallj
902|['chrisbrown', 'KendallJenner']|mhiiddeolq select ovspeople stores xglqxs kendallandkylieforovs
903|['chrisbrown', 'KendallJenner']|njbbhqj select ovspeople stores xglqxs kendallandkylieforovs
904|['KendallJenner', 'JimCarrey']|gyrcss nav rhaxgpwsft tickets fccn obfkit
905|['KendallJenner', 'chrisbrown']|face trust gyrcss nav angelkendallj archived
906|['chrisbrown', 'KendallJenner']|archived mpppg tune gagjixzo njbbhqj kardashianukfan
907|['chrisbrown', 'KendallJenner']|agi kendalljexnner wooo mhiiddeolq rhaxgpwsft kffiunh
908|['chrisbrown', 'KendallJenner']|obfkit agi agi tickets fccn obfkit
909|['chrisbrown', 'KendallJenner']|wooo agi stores xglqxs kendallandkylieforovs wzyq
910|['chrisbrown', 'KendallJenner']|tcj idontdie joynerlucas jbeex kendall kylie
911|['chrisbrown', 'KendallJenner']|fccn obfkit agi rhaxgpwsft kfwnizyunp xglqxs
912|['chrisbrown', 'KendallJenner']|dont die thoughts kffiunh nhb kardashianukfan
913|['chrisbrown', 'KendallJenner']|fccn obfkit agi kendalljexnner wooo dmxab
914|['chrisbrown', 'KendallJenner']|kendall kylie select ovspeople stores xglqxs
915|['chrisbrown', 'KendallJenner']|die thoughts kffiunh enjoy weirdness dmxab
916|['KendallJenner', 'Zendaya']|joynerlucas jbeex agi expoi kffiunh wooo
917|['Zendaya', 'TheEllenShow']|expoi smallfoot exists suckas han qwhs
918|['Zendaya', 'chrisbrown']|round nsync word posh spice baby
919|['chrisbrown', 'iamwill']|yiid die thoughts kffiunh preparing walk
920|['chrisbrown', 'KendallJenner']|izirqis tulsa amazing yufrfqgl ready rhaxgpwsft
921|['chrisbrown', 'KendallJenner']|bxhiq bxhiq kendall kylie select ovspeople
922|['chrisbrown', 'KendallJenner']|joynerlucas jbeex obfkit agi mhiiddeolq angelkendallj
923|['chrisbrown', 'KendallJenner']|yup expoi kkszkazhfd kffiunh rhaxgpwsft kendall
924|['chrisbrown', 'KendallJenner']|yup expoi archived enjoy weirdness dmxab
925|['chrisbrown', 'KendallJenner']|wvs kkszkazhfd archived kfwnizyunp kendallandkylieforovs wzyq
926|['KendallJenner', 'ddlovato']|obfkit agi tickets fccn obfkit agi
927|['ddlovato', 'chrisbrown']|bbmas nominations dhg kvhq bwfxlby phone
928|['chrisbrown', 'KendallJenner']|coachellaaaaaa nnw xdsjxm nnw xdsjxm mpppg
929|['KendallJenner', 'ConanOBrien']|heartbreakonafullmoontour tickets fccn obfkit agi kffiunh
930|['KendallJenner', 'chrisbrown']|preparation infinity war watching chris hemsworth
931|['chrisbrown', 'KendallJenner']|oxd rhaxgpwsft bxhiq kendallandkylieforovs wzyq bxhiq
932|['chrisbrown', 'KendallJenner']|gagjixzo njbbhqj enjoy weirdness dmxab tcj
933|['KendallJenner', 'kanyewest']|select ovspeople stores xglqxs kendallandkylieforovs wzyq
934|['KendallJenner', 'chrisbrown']|beings backgrounds ijtes mmby wzyq bxhiq
935|['chrisbrown', 'PlayStation']|uabum oxd horses gagjixzo njbbhqj fccn
936|['chrisbrown', 'KendallJenner']|war game director cory barlog thinks
937|['KendallJenner', 'Eminem']|iiqwhhpyqj tune gagjixzo njbbhqj thoughts kffiunh
938|['KendallJenner', 'chrisbrown']|hit site weekend gallery cent drdre
939|['KendallJenner', 'chrisbrown']|weirdness dmxab tcj yup expoi kkszkazhfd
940|['chrisbrown', 'JLo']|mhiiddeolq kardashianukfan kendall horses xglqxs kendallandkylieforovs
941|['JLo', 'KingJames']|elanillo applemusic bgtyc playlist thealistpoplatino applemusices
942|['JLo', 'KendallJenner']|love respect young king good luck
943|['KendallJenner', 'chrisbrown']|oxd stores xglqxs kendallandkylieforovs wzyq bxhiq
944|['KendallJenner', 'chrisbrown']|die thoughts kffiunh wzyq bxhiq bxhiq
945|['KendallJenner', 'chrisbrown']|kendall kylie select ovspeople stores xglqxs
