946|['KendallJenner', 'chrisbrown']|rhaxgpwsft kylie select ovspeople stores xglqxs
947|['KendallJenner', 'chrisbrown']|tcj oxd angelkendallj archived dmxab tcj
948|['KendallJenner', 'chrisbrown']|kardashianukfan kendall horses kffiunh kfwnizyunp dont
949|['KendallJenner', 'chrisbrown']|ukeehy tcu stores xglqxs kendallandkylieforovs wzyq
950|['KendallJenner', 'chrisbrown']|tcu wvs kkszkazhfd tcj yup expoi
951|['KendallJenner', 'chrisbrown']|gyrcss nav dont die thoughts kffiunh
952|['KendallJenner', 'chrisbrown']|rhaxgpwsft enjoy weirdness dmxab tcj tcj
953|['KendallJenner', 'chrisbrown']|rhaxgpwsft agi enjoy weirdness dmxab tcj
954|['KendallJenner', 'chrisbrown']|ukeehy tcu tune gagjixzo njbbhqj heartbreakonafullmoontour
955|['chrisbrown', 'kourtneykardash']|weirdness dmxab tcj mpppg kendall kylie
956|['chrisbrown', 'KendallJenner']|thoughts kffiunh rhaxgpwsft leafy green smoothie
957|['KendallJenner', 'MariahCarey']|kendall kylie select ovspeople stores xglqxs
958|['MariahCarey', 'nytimes']|pvl kardashianukfan kendall horses received appreciated
959|['nytimes', 'KendallJenner']|colombian cartel bnlkmw charles koch foundation
960|['KendallJenner', 'chrisbrown']|foundation voice hiring firing professors hmt
961|['KendallJenner', 'chrisbrown']|kendallandkylieforovs wzyq bxhiq heartbreakonafullmoontour tickets fccn
962|['KendallJenner', 'chrisbrown']|thoughts kffiunh bxhiq nhb heartbreakonafullmoontour tickets
963|['chrisbrown', 'TreySongz']|nav agi wooo tickets fccn obfkit
964|['chrisbrown', 'KendallJenner']|kffiunh mhiiddeolq tones neu roses amazing
965|['KendallJenner', 'chrisbrown']|tune gagjixzo njbbhqj tickets fccn obfkit
966|['KendallJenner', 'chrisbrown']|idontdie joynerlucas jbeex joynerlucas jbeex mhiiddeolq
967|['KendallJenner', 'chrisbrown']|heartbreakonafullmoontour tickets fccn obfkit agi gyrcss
968|['KendallJenner', 'chrisbrown']|iiqwhhpyqj ovspeople stores xglqxs kendallandkylieforovs wzyq
969|['chrisbrown', 'NFL']|kendalljexnner wooo bxhiq fccn obfkit agi
970|['chrisbrown', 'KendallJenner']|stackz patriots offense dwwbbambaa barkley sony
971|['KendallJenner', 'chrisbrown']|kylie select ovspeople stores xglqxs kendallandkylieforovs
972|['KendallJenner', 'chrisbrown']|kffiunh kardashianukfan kendall horses wzyq bxhiq
973|['KendallJenner', 'chrisbrown']|wooo fccn obfkit agi ukeehy tcu
974|['KendallJenner', 'chrisbrown']|jbeex njbbhqj archived nav ready rhaxgpwsft
975|['chrisbrown', 'ABC']|ovspeople stores xglqxs kendallandkylieforovs wzyq bxhiq
976|['chrisbrown', 'KendallJenner']|jvgrkybruw year alive today apple watch
977|['KendallJenner', 'NBA']|kffiunh wzyq bxhiq kffiunh kardashianukfan kendall
978|['KendallJenner', 'chrisbrown']|night nbaplayoffs action qmlwlb finishes inbounds
979|['KendallJenner', 'chrisbrown']|ovspeople stores xglqxs kendallandkylieforovs wzyq bxhiq
980|['KendallJenner', 'chrisbrown']|ovspeople stores xglqxs kendallandkylieforovs wzyq bxhiq
981|['KendallJenner', 'chrisbrown']|die thoughts kffiunh thoughts kffiunh angelkendallj
982|['KendallJenner', 'chrisbrown']|enjoy weirdness dmxab tcj kardashianukfan kendall
983|['KendallJenner', 'chrisbrown']|njbbhqj dont die thoughts kffiunh kardashianukfan
984|['KendallJenner', 'chrisbrown']|ovspeople stores xglqxs kendallandkylieforovs wzyq bxhiq
985|['KendallJenner', 'chrisbrown']|kylie select ovspeople stores xglqxs kendallandkylieforovs
986|['chrisbrown', 'Usher']|wooo kylie select ovspeople stores xglqxs
987|['chrisbrown', 'KendallJenner']|rhaxgpwsft dont die thoughts kffiunh heartbreakonafullmoontour
988|['KendallJenner', 'chrisbrown']|horses stores xglqxs kendallandkylieforovs wzyq bxhiq
989|['chrisbrown', 'HillaryClinton']|tune gagjixzo njbbhqj uabum oxd tune
990|['chrisbrown', 'KendallJenner']|today great initiative foster kids chance
991|['KendallJenner', 'chrisbrown']|dmxab tcj nav fccn obfkit agi
992|['KendallJenner', 'chrisbrown']|iiqwhhpyqj tickets fccn obfkit agi select
993|['KendallJenner', 'chrisbrown']|kylie select ovspeople stores xglqxs kendallandkylieforovs
994|['KendallJenner', 'chrisbrown']|kkszkazhfd uabum oxd expoi nhb tcu
995|['KendallJenner', 'chrisbrown']|expoi gagjixzo njbbhqj wzyq bxhiq wvs
996|['KendallJenner', 'chrisbrown']|mhiiddeolq mhiiddeolq wzyq bxhiq heartbreakonafullmoontour tickets
997|['KendallJenner', 'chrisbrown']|iiqwhhpyqj archived mhiiddeolq xglqxs kendallandkylieforovs wzyq
998|['chrisbrown', 'Eminem']|iiqwhhpyqj xglqxs kendallandkylieforovs wzyq bxhiq wvs
999|['chrisbrown', 'KendallJenner']|bandana coach lla hit site weekend
1000|['KendallJenner', 'chrisbrown']|wvs kkszkazhfd weirdness dmxab tcj stores
1001|['KendallJenner', 'chrisbrown']|ready rhaxgpwsft mhiiddeolq oxd tcj archived
1002|['KendallJenner', 'chrisbrown']|heartbreakonafullmoontour tickets fccn obfkit agi wvs
1003|['KendallJenner', 'chrisbrown']|wvs kkszkazhfd mhiiddeolq oxd ukeehy tcu
1004|['KendallJenner', 'chrisbrown']|wvs kkszkazhfd tune gagjixzo njbbhqj kardashianukfan
1005|['KendallJenner', 'chrisbrown']|kardashianukfan kendall horses thoughts kffiunh yup
1006|['KendallJenner', 'chrisbrown']|die thoughts kffiunh stores xglqxs kendallandkylieforovs
1007|['KendallJenner', 'chrisbrown']|tickets fccn obfkit agi kardashianukfan kendall
1008|['KendallJenner', 'chrisbrown']|gagjixzo njbbhqj fccn obfkit agi expoi
1009|['KendallJenner', 'chrisbrown']|jbeex nhb select ovspeople stores xglqxs
1010|['KendallJenner', 'chrisbrown']|nav weirdness dmxab tcj rhaxgpwsft oxd
1011|['KendallJenner', 'chrisbrown']|idontdie joynerlucas jbeex kffiunh joynerlucas jbeex
1012|['KendallJenner', 'chrisbrown']|die thoughts kffiunh nav jbeex wzyq
1013|['chrisbrown', 'SportsCenter']|idontdie joynerlucas jbeex joynerlucas jbeex bxhiq
1014|['chrisbrown', 'KendallJenner']|mpppg amateur golf tournament round flmg
1015|['KendallJenner', 'chrisbrown']|kendallandkylieforovs wzyq bxhiq kendallandkylieforovs wzyq bxhiq
1016|['KendallJenner', 'chrisbrown']|yup expoi archived mhiiddeolq kendall kylie
1017|['KendallJenner', 'chrisbrown']|nav heartbreakonafullmoontour tickets fccn obfkit agi
1018|['KendallJenner', 'chrisbrown']|kendalljexnner wooo kfwnizyunp kkszkazhfd xglqxs kendallandkylieforovs
1019|['KendallJenner', 'chrisbrown']|wooo heartbreakonafullmoontour tickets fccn obfkit agi
1020|['KendallJenner', 'chrisbrown']|kardashianukfan kendall horses ready rhaxgpwsft ready
1021|['KendallJenner', 'chrisbrown']|enjoy weirdness dmxab tcj kffiunh dmxab
1022|['KendallJenner', 'chrisbrown']|njbbhqj agi mpppg kendalljexnner wooo weirdness
1023|['KendallJenner', 'chrisbrown']|tcj bxhiq kfwnizyunp kylie select ovspeople
1024|['chrisbrown', 'KendallJenner']|jbeex kardashianukfan kendall horses tcu kendalljexnner
1025|['KendallJenner', 'chrisbrown']|gagjixzo njbbhqj kendall kylie select ovspeople
1026|['chrisbrown', 'tyrabanks']|iiqwhhpyqj kendalljexnner wooo kendall kylie select
1027|['tyrabanks', 'aplusk']|nkodjsut ready rhaxgpwsft thoughts kffiunh die
1028|['aplusk', 'KendallJenner']|hey tygers monday love tech giant
1029|['KendallJenner', 'chrisbrown']|hookers shows lack empathy understanding issue
1030|['KendallJenner', 'chrisbrown']|mhiiddeolq uabum oxd kardashianukfan kendall horses
1031|['KendallJenner', 'chrisbrown']|die thoughts kffiunh gagjixzo njbbhqj kfwnizyunp
1032|['KendallJenner', 'chrisbrown']|tickets fccn obfkit agi tcu weirdness
1033|['KendallJenner', 'chrisbrown']|tickets fccn obfkit agi rhaxgpwsft wzyq
1034|['KendallJenner', 'chrisbrown']|die thoughts kffiunh kendalljexnner wooo jbeex
1035|['KendallJenner', 'chrisbrown']|enjoy weirdness dmxab tcj kendalljexnner wooo
1036|['KendallJenner', 'chrisbrown']|joynerlucas jbeex mpppg kfwnizyunp horses angelkendallj
1037|['KendallJenner', 'chrisbrown']|select ovspeople stores xglqxs kendallandkylieforovs wzyq
1038|['KendallJenner', 'chrisbrown']|rhaxgpwsft bxhiq agi kardashianukfan kendall horses
1039|['KendallJenner', 'chrisbrown']|bxhiq tune gagjixzo njbbhqj nav rhaxgpwsft
1040|['KendallJenner', 'chrisbrown']|ovspeople stores xglqxs kendallandkylieforovs wzyq bxhiq
1041|['KendallJenner', 'chrisbrown']|tickets fccn obfkit agi yup expoi
1042|['KendallJenner', 'chrisbrown']|heartbreakonafullmoontour tickets fccn obfkit agi joynerlucas
1043|['KendallJenner', 'chrisbrown']|tcu kendalljexnner wooo oxd expoi stores
1044|['chrisbrown', 'SportsCenter']|dont die thoughts kffiunh dmxab tcj
1045|['chrisbrown', 'KendallJenner']|die thoughts kffiunh told dangrazianoespn sqenljl
1046|['KendallJenner', 'chrisbrown']|ready rhaxgpwsft nhb ready rhaxgpwsft obfkit
1047|['chrisbrown', 'ArianaGrande']|nhb heartbreakonafullmoontour tickets fccn obfkit agi
1048|['chrisbrown', 'KendallJenner']|tvyou favorite forever tune nbudimsjox dude
1049|['KendallJenner', 'camerondallas']|obfkit agi ovspeople stores xglqxs kendallandkylieforovs
1050|['KendallJenner', 'chrisbrown']|wzyq bxhiq endings movies make uncomfortable
1051|['KendallJenner', 'chrisbrown']|kardashianukfan kendall horses select ovspeople stores
1052|['KendallJenner', 'chrisbrown']|enjoy weirdness dmxab tcj uabum oxd
1053|['chrisbrown', 'MariahCarey']|ready rhaxgpwsft ready rhaxgpwsft fccn obfkit
1054|['MariahCarey', 'SethMacFarlane']|thoughts kffiunh ybuxcpaiak presale starts tue
1055|['SethMacFarlane', 'KendallJenner']|brand residency butterfly returns beginning july
1056|['KendallJenner', 'chrisbrown']|captain fuckin kirk sir znw rtx
1057|['chrisbrown', 'NICKIMINAJ']|ready rhaxgpwsft njbbhqj kfwnizyunp ovspeople stores
1058|['chrisbrown', 'KendallJenner']|platforms time tho tdtbiujyv fccn obfkit
1059|['KendallJenner', 'aliciakeys']|wzyq bxhiq archived xglqxs kendallandkylieforovs wzyq
1060|['KendallJenner', 'chrisbrown']|sisss janellemonae ieb egtk stores xglqxs
1061|['KendallJenner', 'chrisbrown']|wvs kkszkazhfd nhb fccn obfkit agi
1062|['KendallJenner', 'chrisbrown']|expoi stores xglqxs kendallandkylieforovs wzyq bxhiq
1063|['KendallJenner', 'chrisbrown']|tcu kendall kylie select ovspeople stores
1064|['KendallJenner', 'chrisbrown']|nav wooo tcj joynerlucas jbeex weirdness
1065|['chrisbrown', 'MariahCarey']|fccn obfkit agi gyrcss nav angelkendallj
1066|['MariahCarey', 'taylorswift13']|rip herb ritts myall kpslpo pvl
1067|['MariahCarey', 'KendallJenner']|movie zqx hlj future edsheeran xhrs
1068|['KendallJenner', 'ddlovato']|sale friday tickets amp dates visit
1069|['KendallJenner', 'chrisbrown']|kendallandkylieforovs wzyq bxhiq closest left side
1070|['KendallJenner', 'chrisbrown']|bxhiq heartbreakonafullmoontour tickets fccn obfkit agi
1071|['KendallJenner', 'chrisbrown']|enjoy weirdness dmxab tcj tickets fccn
1072|['KendallJenner', 'chrisbrown']|wzyq bxhiq kylie select ovspeople stores
1073|['KendallJenner', 'chrisbrown']|wzyq bxhiq ukeehy tcu die thoughts
1074|['KendallJenner', 'chrisbrown']|rhaxgpwsft thoughts kffiunh bxhiq oxd kffiunh
1075|['KendallJenner', 'chrisbrown']|mpppg gagjixzo njbbhqj njbbhqj tcu wzyq
1076|['KendallJenner', 'chrisbrown']|kendall kylie select ovspeople stores xglqxs
1077|['KendallJenner', 'chrisbrown']|rhaxgpwsft stores xglqxs kendallandkylieforovs wzyq bxhiq
1078|['KendallJenner', 'chrisbrown']|ready rhaxgpwsft tune gagjixzo njbbhqj bxhiq
1079|['chrisbrown', 'tomhanks']|kkszkazhfd enjoy weirdness dmxab tcj nhb
1080|['tomhanks', 'nytimes']|row kevin turk tomhanksday lifeline energy
1081|['tomhanks', 'KendallJenner']|years row kevin turk tomhanksday lifeline
1082|['KendallJenner', 'wizkhalifa']|kardashianukfan kendall horses rural kenya technology
1083|['KendallJenner', 'chrisbrown']|kendallandkylieforovs wzyq bxhiq swssy yup expoi
1084|['KendallJenner', 'chrisbrown']|iiqwhhpyqj idontdie joynerlucas jbeex xglqxs kendallandkylieforovs
1085|['KendallJenner', 'chrisbrown']|bxhiq ukeehy tcu uabum oxd dmxab
1086|['chrisbrown', 'Beyonce']|bxhiq kendalljexnner wooo joynerlucas jbeex wvs
1087|['chrisbrown', 'KendallJenner']|kindness iwashere whd iwashere wzbads initiative
1088|['KendallJenner', 'ObamaWhiteHouse']|select ovspeople stores xglqxs kendallandkylieforovs wzyq
1089|['KendallJenner', 'chrisbrown']|horses created equal uebl frp wzyq
1090|['KendallJenner', 'chrisbrown']|uabum oxd horses kylie select ovspeople
1091|['KendallJenner', 'chrisbrown']|stores xglqxs kendallandkylieforovs wzyq bxhiq joynerlucas
1092|['KendallJenner', 'chrisbrown']|bxhiq ovspeople stores xglqxs kendallandkylieforovs wzyq
1093|['chrisbrown', 'tomhanks']|oxd kardashianukfan kendall horses kendall kylie
1094|['chrisbrown', 'KendallJenner']|champ anthony joshua graham norton sho
1095|['KendallJenner', 'chrisbrown']|horses heartbreakonafullmoontour tickets fccn obfkit agi
1096|['KendallJenner', 'chrisbrown']|tune gagjixzo njbbhqj archived tickets fccn
1097|['chrisbrown', 'iamwill']|njbbhqj gyrcss nav iiqwhhpyqj nav expoi
1098|['iamwill', 'Pink']|build future ideas imtiredofthisnoise uokgkqaq donate
1099|['Pink', 'KendallJenner']|mad turn meand half pillowwwww txkuzaq
1100|['KendallJenner', 'chrisbrown']|weirdness dmxab tcj happy ruycdbcylu kardashianukfan
1101|['KendallJenner', 'chrisbrown']|kfwnizyunp gagjixzo njbbhqj tcj wooo dmxab
1102|['KendallJenner', 'chrisbrown']|uabum oxd oxd iiqwhhpyqj rhaxgpwsft fccn
1103|['KendallJenner', 'chrisbrown']|tcj rhaxgpwsft yup expoi horses kfwnizyunp
1104|['KendallJenner', 'chrisbrown']|wzyq bxhiq gagjixzo njbbhqj dmxab tcj
1105|['KendallJenner', 'chrisbrown']|select ovspeople stores xglqxs kendallandkylieforovs wzyq
1106|['KendallJenner', 'chrisbrown']|joynerlucas jbeex rhaxgpwsft wvs kkszkazhfd heartbreakonafullmoontour
1107|['KendallJenner', 'chrisbrown']|yup expoi bxhiq bxhiq tickets fccn
1108|['chrisbrown', 'JimCarrey']|kendalljexnner wooo ready rhaxgpwsft kendall kylie
1109|['chrisbrown', 'KendallJenner']|bus people prison oohagvzqfz idontdie joynerlucas
1110|['KendallJenner', 'kourtneykardash']|gyrcss nav kendallandkylieforovs wzyq bxhiq wooo
1111|['kourtneykardash', 'Pink']|kardashianukfan kendall horses gagjixzo njbbhqj refreshing
1112|['kourtneykardash', 'KendallJenner']|fgm xrnrspazmf nug yur mad turn
1113|['KendallJenner', 'chrisbrown']|stores xglqxs kendallandkylieforovs wzyq bxhiq mttcsqboy
1114|['KendallJenner', 'chrisbrown']|wvs kkszkazhfd uabum oxd expoi joynerlucas
1115|['KendallJenner', 'chrisbrown']|kendallandkylieforovs wzyq bxhiq dmxab tcj kendalljexnner
1116|['KendallJenner', 'chrisbrown']|thoughts kffiunh yup expoi rhaxgpwsft kardashianukfan
1117|['KendallJenner', 'chrisbrown']|tickets fccn obfkit agi weirdness dmxab
1118|['KendallJenner', 'chrisbrown']|iiqwhhpyqj kylie select ovspeople stores xglqxs
1119|['chrisbrown', 'kourtneykardash']|njbbhqj kardashianukfan kendall horses jbeex wzyq
1120|['chrisbrown', 'KendallJenner']|ready ojkdjzazjr mpppg kjbeczfblm kkszkazhfd word
1121|['KendallJenner', 'KDTrey5']|mpppg enjoy weirdness dmxab tcj dmxab
1122|['KendallJenner', 'chrisbrown']|warriors practice facility books sign open
1123|['KendallJenner', 'chrisbrown']|wzyq bxhiq tune gagjixzo njbbhqj archived
1124|['chrisbrown', 'NICKIMINAJ']|mhiiddeolq weirdness dmxab tcj ukeehy tcu
1125|['chrisbrown', 'KendallJenner']|time wvs kkszkazhfd ready rhaxgpwsft heartbreakonafullmoontour
1126|['KendallJenner', 'chrisbrown']|fccn obfkit agi enjoy weirdness dmxab
1127|['KendallJenner', 'chrisbrown']|angelkendallj archived kendallandkylieforovs wzyq bxhiq jbeex
1128|['KendallJenner', 'chrisbrown']|kardashianukfan kendall horses tune gagjixzo njbbhqj
1129|['chrisbrown', 'ObamaWhiteHouse']|weirdness dmxab tcj dont die thoughts
1130|['chrisbrown', 'KendallJenner']|mpppg iiqwhhpyqj wing week happening white
1131|['KendallJenner', 'chrisbrown']|idontdie joynerlucas jbeex mhiiddeolq fccn obfkit
1132|['KendallJenner', 'chrisbrown']|bxhiq tcj enjoy weirdness dmxab tcj
1133|['chrisbrown', 'britneyspears']|xglqxs kendallandkylieforovs wzyq bxhiq thoughts kffiunh
1134|['chrisbrown', 'KendallJenner']|park mvzg kkszkazhfd sgz mcel tickets
1135|['KendallJenner', 'chrisbrown']|thoughts kffiunh wzyq bxhiq dmxab tcj
1136|['KendallJenner', 'chrisbrown']|rhaxgpwsft dmxab tcj horses kendall kylie
1137|['KendallJenner', 'chrisbrown']|oxd expoi ukeehy tcu mhiiddeolq jbeex
1138|['KendallJenner', 'chrisbrown']|nhb obfkit agi select ovspeople stores
1139|['KendallJenner', 'chrisbrown']|dmxab tcj heartbreakonafullmoontour tickets fccn obfkit
1140|['KendallJenner', 'chrisbrown']|agi kfwnizyunp angelkendallj archived die thoughts
1141|['KendallJenner', 'chrisbrown']|idontdie joynerlucas jbeex ready rhaxgpwsft die
1142|['KendallJenner', 'chrisbrown']|weirdness dmxab tcj ready rhaxgpwsft mpppg
1143|['KendallJenner', 'chrisbrown']|tcu enjoy weirdness dmxab tcj tickets
1144|['KendallJenner', 'chrisbrown']|stores xglqxs kendallandkylieforovs wzyq bxhiq obfkit
1145|['KendallJenner', 'chrisbrown']|weirdness dmxab tcj fccn obfkit agi
1146|['KendallJenner', 'chrisbrown']|expoi kardashianukfan kendall horses gyrcss nav
1147|['KendallJenner', 'chrisbrown']|wvs kkszkazhfd enjoy weirdness dmxab tcj
1148|['KendallJenner', 'chrisbrown']|jbeex tickets fccn obfkit agi obfkit
1149|['KendallJenner', 'chrisbrown']|ready rhaxgpwsft select ovspeople stores xglqxs
1150|['KendallJenner', 'chrisbrown']|yup expoi kffiunh angelkendallj archived iiqwhhpyqj
1151|['chrisbrown', 'LeoDiCaprio']|oxd heartbreakonafullmoontour tickets fccn obfkit agi
1152|['chrisbrown', 'KendallJenner']|make impact jjasow jagpacqnba fuels kingoenergy
1153|['KendallJenner', 'maroon5']|gagjixzo njbbhqj heartbreakonafullmoontour tickets fccn obfkit
1154|['KendallJenner', 'chrisbrown']|enjoy weirdness dmxab tcj angelkendallj archived
1155|['KendallJenner', 'chrisbrown']|thoughts kffiunh gyrcss nav heartbreakonafullmoontour tickets
1156|['KendallJenner', 'chrisbrown']|weirdness dmxab tcj die thoughts kffiunh
1157|['KendallJenner', 'chrisbrown']|heartbreakonafullmoontour tickets fccn obfkit agi weirdness
1158|['chrisbrown', 'tomhanks']|horses enjoy weirdness dmxab tcj jbeex
1159|['tomhanks', 'KevinHart4real']|rural kenya technology ffyn hwzd tickets
1160|['tomhanks', 'KendallJenner']|business amp ris zza license hanx
1161|['KendallJenner', 'chrisbrown']|gyrcss nav years row kevin turk
1162|['KendallJenner', 'chrisbrown']|angelkendallj archived tcj tickets fccn obfkit
1163|['KendallJenner', 'chrisbrown']|thoughts kffiunh wooo wooo xglqxs kendallandkylieforovs
1164|['KendallJenner', 'chrisbrown']|thoughts kffiunh kendalljexnner wooo joynerlucas jbeex
1165|['KendallJenner', 'chrisbrown']|rhaxgpwsft rhaxgpwsft die thoughts kffiunh uabum
1166|['chrisbrown', 'camerondallas']|oxd wzyq bxhiq jbeex iiqwhhpyqj archived
1167|['chrisbrown', 'KendallJenner']|kkszkazhfd wvs kkszkazhfd rhaxgpwsft tcu nhb
1168|['KendallJenner', 'chrisbrown']|jbeex wooo wzyq bxhiq die thoughts
1169|['KendallJenner', 'chrisbrown']|tune gagjixzo njbbhqj kendall kylie select
1170|['chrisbrown', 'SportsCenter']|horses thoughts kffiunh bxhiq dmxab tcj
1171|['chrisbrown', 'KendallJenner']|mhiiddeolq agi dont die thoughts kffiunh
1172|['KendallJenner', 'chrisbrown']|nhb kendalljexnner wooo tcu heartbreakonafullmoontour tickets
1173|['KendallJenner', 'chrisbrown']|xglqxs kendallandkylieforovs wzyq bxhiq wvs kkszkazhfd
1174|['KendallJenner', 'chrisbrown']|njbbhqj weirdness dmxab tcj kendall kylie
1175|['KendallJenner', 'chrisbrown']|rhaxgpwsft iiqwhhpyqj archived obfkit agi angelkendallj
1176|['chrisbrown', 'NBA']|thoughts kffiunh njbbhqj mhiiddeolq jbeex nhb
1177|['chrisbrown', 'KendallJenner']|lead orleans dubnation nbaplayoffs hvqczu sgy
1178|['KendallJenner', 'chrisbrown']|angelkendallj archived bxhiq dmxab tcj tcj
1179|['KendallJenner', 'chrisbrown']|uabum oxd kylie select ovspeople stores
1180|['KendallJenner', 'chrisbrown']|dmxab tcj wzyq bxhiq archived wooo
1181|['KendallJenner', 'chrisbrown']|kendallandkylieforovs wzyq bxhiq yup expoi kkszkazhfd
1182|['chrisbrown', 'maroon5']|wooo ready rhaxgpwsft fccn obfkit agi
1183|['chrisbrown', 'KendallJenner']|die thoughts kffiunh heartbreakonafullmoontour tickets fccn
1184|['KendallJenner', 'chrisbrown']|kffiunh rhaxgpwsft angelkendallj archived njbbhqj oxd
1185|['KendallJenner', 'chrisbrown']|mhiiddeolq kendallandkylieforovs wzyq bxhiq kffiunh mhiiddeolq
1186|['KendallJenner', 'chrisbrown']|joynerlucas jbeex kardashianukfan kendall horses tickets
1187|['KendallJenner', 'chrisbrown']|tickets fccn obfkit agi kardashianukfan kendall
1188|['KendallJenner', 'chrisbrown']|jbeex kendallandkylieforovs wzyq bxhiq tickets fccn
1189|['KendallJenner', 'chrisbrown']|heartbreakonafullmoontour tickets fccn obfkit agi xglqxs
1190|['KendallJenner', 'chrisbrown']|joynerlucas jbeex nhb kendallandkylieforovs wzyq bxhiq
1191|['KendallJenner', 'chrisbrown']|tcu mhiiddeolq kendallandkylieforovs wzyq bxhiq select
1192|['KendallJenner', 'chrisbrown']|kfwnizyunp tcu expoi tickets fccn obfkit
1193|['KendallJenner', 'chrisbrown']|wzyq bxhiq kendalljexnner wooo bxhiq expoi
1194|['KendallJenner', 'chrisbrown']|kendall kylie select ovspeople stores xglqxs
1195|['KendallJenner', 'chrisbrown']|horses dont die thoughts kffiunh tcu
1196|['KendallJenner', 'chrisbrown']|heartbreakonafullmoontour tickets fccn obfkit agi kendall
1197|['KendallJenner', 'chrisbrown']|kendall kylie select ovspeople stores xglqxs
1198|['KendallJenner', 'chrisbrown']|horses kylie select ovspeople stores xglqxs
1199|['chrisbrown', 'kobebryant']|horses gagjixzo njbbhqj dmxab tcj kendallandkylieforovs
1200|['chrisbrown', 'KendallJenner']|mhiiddeolq skydigg kporzee yevojffhle houstonrockets nbaplayoffs
1201|['KendallJenner', 'chrisbrown']|uabum oxd wooo idontdie joynerlucas jbeex
1202|['chrisbrown', 'MileyCyrus']|kendallandkylieforovs wzyq bxhiq stores xglqxs kendallandkylieforovs
1203|['chrisbrown', 'KendallJenner']|watch jimmykimmellive kimmel conversexmiley nis qwrd
1204|['KendallJenner', 'chrisbrown']|select ovspeople stores xglqxs kendallandkylieforovs wzyq
1205|['chrisbrown', 'BigSean']|kkszkazhfd kfwnizyunp angelkendallj archived kendalljexnner wooo
1206|['chrisbrown', 'KendallJenner']|obfkit agi times life doubt dtqymkjku
1207|['KendallJenner', 'chrisbrown']|heartbreakonafullmoontour tickets fccn obfkit agi rhaxgpwsft
1208|['KendallJenner', 'chrisbrown']|wzyq bxhiq kendall kylie select ovspeople
1209|['KendallJenner', 'chrisbrown']|tcu heartbreakonafullmoontour tickets fccn obfkit agi
1210|['KendallJenner', 'chrisbrown']|kendalljexnner wooo expoi xglqxs kendallandkylieforovs wzyq
1211|['KendallJenner', 'chrisbrown']|kfwnizyunp mhiiddeolq kylie select ovspeople stores
1212|['KendallJenner', 'chrisbrown']|yup expoi kendall kylie select ovspeople
1213|['chrisbrown', 'pitbull']|gyrcss nav weirdness dmxab tcj wvs
1214|['chrisbrown', 'KendallJenner']|afternoon emergeamericas emerge vegas time lives
1215|['KendallJenner', 'chrisbrown']|nhb tcj expoi gyrcss nav wzyq
1216|['KendallJenner', 'chrisbrown']|stores xglqxs kendallandkylieforovs wzyq bxhiq weirdness
1217|['KendallJenner', 'chrisbrown']|agi ovspeople stores xglqxs kendallandkylieforovs wzyq
1218|['KendallJenner', 'chrisbrown']|tickets fccn obfkit agi tickets fccn
1219|['KendallJenner', 'chrisbrown']|tcu die thoughts kffiunh agi njbbhqj
1220|['KendallJenner', 'chrisbrown']|kffiunh kylie select ovspeople stores xglqxs
1221|['KendallJenner', 'chrisbrown']|heartbreakonafullmoontour tickets fccn obfkit agi yup
1222|['chrisbrown', 'KylieJenner']|weirdness dmxab tcj jbeex die thoughts
1223|['KylieJenner', 'wizkhalifa']|site bdaiohhxcv sxm site bdaiohhxcv sxm
1224|['wizkhalifa', 'KDTrey5']|kyliecosmetics gpk uygxjx time hat style
1225|['KDTrey5', 'xtina']|hates car slicc txt phone xycx
1226|['KDTrey5', 'KendallJenner']|winner lewishamilton teamlh fun azerbaijangp jnogsgr
1227|['KendallJenner', 'chrisbrown']|sending pizza team proud work bay
1228|['KendallJenner', 'chrisbrown']|yup expoi oxd angelkendallj archived nav
1229|['KendallJenner', 'chrisbrown']|dmxab tcj weirdness dmxab tcj kendall
1230|['KendallJenner', 'chrisbrown']|xglqxs kendallandkylieforovs wzyq bxhiq agi nhb
1231|['KendallJenner', 'chrisbrown']|jbeex tickets fccn obfkit agi fccn
1232|['KendallJenner', 'chrisbrown']|tickets fccn obfkit agi nhb tcu
1233|['KendallJenner', 'chrisbrown']|kendall kylie select ovspeople stores xglqxs
1234|['KendallJenner', 'chrisbrown']|nav heartbreakonafullmoontour tickets fccn obfkit agi
1235|['chrisbrown', 'pitbull']|kkszkazhfd njbbhqj mhiiddeolq kfwnizyunp select ovspeople
1236|['chrisbrown', 'KendallJenner']|sailing nyc benimb uingy dont die
1237|['KendallJenner', 'chrisbrown']|kylie select ovspeople stores xglqxs kendallandkylieforovs
1238|['KendallJenner', 'chrisbrown']|nhb kendalljexnner wooo nhb idontdie joynerlucas
1239|['KendallJenner', 'chrisbrown']|njbbhqj ukeehy tcu select ovspeople stores
1240|['KendallJenner', 'chrisbrown']|tcu heartbreakonafullmoontour tickets fccn obfkit agi
1241|['KendallJenner', 'chrisbrown']|kfwnizyunp expoi bxhiq kendalljexnner wooo heartbreakonafullmoontour
1242|['chrisbrown', 'kanyewest']|tcu mpppg gagjixzo njbbhqj wzyq bxhiq
1243|['chrisbrown', 'KendallJenner']|freed thousand knew slaves harriet tubman
1244|['KendallJenner', 'chrisbrown']|ready rhaxgpwsft angelkendallj archived wvs kkszkazhfd
1245|['KendallJenner', 'chrisbrown']|die thoughts kffiunh angelkendallj archived bxhiq
1246|['chrisbrown', 'NFL']|mhiiddeolq kendalljexnner wooo weirdness dmxab tcj
1247|['chrisbrown', 'KendallJenner']|mark walton full bexxuafqzr nfldraft krtrcqtwvw
1248|['KendallJenner', 'chrisbrown']|kendallandkylieforovs wzyq bxhiq gyrcss nav ukeehy
1249|['KendallJenner', 'chrisbrown']|stores xglqxs kendallandkylieforovs wzyq bxhiq tickets
1250|['KendallJenner', 'chrisbrown']|wvs kkszkazhfd idontdie joynerlucas jbeex xglqxs
1251|['chrisbrown', 'britneyspears']|rhaxgpwsft stores xglqxs kendallandkylieforovs wzyq bxhiq
1252|['britneyspears', 'MariahCarey']|pieceofme tour dqzjkhzsrs affected sjw heartbreakonafullmoontour
1253|['MariahCarey', 'KendallJenner']|naturally pon studio knocked late nights
1254|['KendallJenner', 'RyanSeacrest']|naturally pon studio knocked late nights
1255|['KendallJenner', 'chrisbrown']|cutout kellyandryan paper anniversary couldn asked
