318|['LeoDiCaprio', 'ConanOBrien']|honored part great initiative empowerment women
319|['LeoDiCaprio', 'chrisbrown']|hacker buff torso safe bringing incredible
320|['chrisbrown', 'kobebryant']|earthmonth nrdc ebay charityus find make
321|['chrisbrown', 'KendallJenner']|mrcramher start understanding concepts high basketball
322|['chrisbrown', 'KendallJenner']|mpppg ready rhaxgpwsft expoi joynerlucas jbeex
323|['chrisbrown', 'KendallJenner']|dont die thoughts kffiunh wvs kkszkazhfd
324|['chrisbrown', 'KendallJenner']|mpppg ukeehy tcu dont die thoughts
325|['KendallJenner', 'selenagomez']|kardashianukfan kendall horses stores xglqxs kendallandkylieforovs
326|['KendallJenner', 'chrisbrown']|colin tilley alfkbrw kfwnizyunp angelkendallj archived
327|['chrisbrown', 'KendallJenner']|heartbreakonafullmoontour tickets fccn obfkit agi archived
328|['KendallJenner', 'nytimes']|iiqwhhpyqj angelkendallj archived kffiunh kendallandkylieforovs wzyq
329|['KendallJenner', 'chrisbrown']|uabum oxd fhl takes asylum ruwjhckqy
330|['chrisbrown', 'KendallJenner']|oxd wvs kkszkazhfd stores xglqxs kendallandkylieforovs
331|['KendallJenner', 'NASA']|kardashianukfan kendall horses mhiiddeolq mhiiddeolq oxd
332|['NASA', 'MileyCyrus']|evening sky nasainsight lander lights night
333|['NASA', 'chrisbrown']|miles ppa xrdze sfiq jzsld oecm
334|['chrisbrown', 'KendallJenner']|live discover tested kilopower project nasa
335|['chrisbrown', 'KendallJenner']|stores xglqxs kendallandkylieforovs wzyq bxhiq archived
336|['chrisbrown', 'KendallJenner']|tcu archived dmxab tcj idontdie joynerlucas
337|['chrisbrown', 'KendallJenner']|ukeehy tcu die thoughts kffiunh kendallandkylieforovs
338|['KendallJenner', 'nytimes']|select ovspeople stores xglqxs kendallandkylieforovs wzyq
339|['KendallJenner', 'chrisbrown']|kremlin iran supreme leader messaging app
340|['chrisbrown', 'KendallJenner']|tickets fccn obfkit agi nhb gyrcss
341|['chrisbrown', 'KendallJenner']|kylie select ovspeople stores xglqxs kendallandkylieforovs
342|['KendallJenner', 'camerondallas']|wooo uabum oxd kendall kylie select
343|['camerondallas', 'Beyonce']|movies make uncomfortable endings movies make
344|['Beyonce', 'BarackObama']|wzbads beyonce world humanitarian day days
345|['Beyonce', 'chrisbrown']|statement passing lady barbara bush mhtvycl
346|['chrisbrown', 'KendallJenner']|theworldneedsmore fvezo dzpa dzpa thoughts kffiunh
347|['chrisbrown', 'KendallJenner']|kffiunh tcu wooo wooo kendalljexnner wooo
348|['chrisbrown', 'KendallJenner']|wzyq bxhiq mhiiddeolq fccn obfkit agi
349|['chrisbrown', 'KendallJenner']|fccn obfkit agi xglqxs kendallandkylieforovs wzyq
350|['chrisbrown', 'KendallJenner']|mpppg ovspeople stores xglqxs kendallandkylieforovs wzyq
351|['chrisbrown', 'KendallJenner']|kardashianukfan kendall horses iiqwhhpyqj die thoughts
352|['KendallJenner', 'KDTrey5']|ovspeople stores xglqxs kendallandkylieforovs wzyq bxhiq
353|['KendallJenner', 'chrisbrown']|bringing energy guys pieology sending pizza
354|['chrisbrown', 'KendallJenner']|njbbhqj joynerlucas jbeex kardashianukfan kendall horses
355|['chrisbrown', 'KendallJenner']|fccn obfkit agi archived ukeehy tcu
356|['chrisbrown', 'KendallJenner']|mhiiddeolq die thoughts kffiunh kylie select
357|['KendallJenner', 'BarackObama']|kffiunh tickets fccn obfkit agi heartbreakonafullmoontour
358|['BarackObama', 'ABC']|private sector academia amp community leaders
359|['BarackObama', 'chrisbrown']|work mbk alliance government private sector
360|['chrisbrown', 'KendallJenner']|jean upset faith pick women involved
361|['KendallJenner', 'BigSean']|kardashianukfan kendall horses archived dmxab tcj
362|['KendallJenner', 'chrisbrown']|doubt dtqymkjku video lol people advice
363|['chrisbrown', 'Zendaya']|tickets fccn obfkit agi nav ukeehy
364|['chrisbrown', 'KendallJenner']|fccn obfkit agi xmokrcuxfh talk gui
365|['chrisbrown', 'KendallJenner']|archived ukeehy tcu agi mhiiddeolq idontdie
366|['KendallJenner', 'Eminem']|nav gyrcss nav uabum oxd nhb
367|['Eminem', 'Zendaya']|eminemaugmented app visuals coach lla hit
368|['Eminem', 'chrisbrown']|dates dycudlf download app eminem show
369|['chrisbrown', 'KendallJenner']|coach lla hit site weekend gallery
370|['KendallJenner', 'SnoopDogg']|xglqxs kendallandkylieforovs wzyq bxhiq mpppg nav
371|['KendallJenner', 'chrisbrown']|night wit adamdevine jokerswild ueqk ypgf
372|['chrisbrown', 'KendallJenner']|dmxab tcj heartbreakonafullmoontour tickets fccn obfkit
373|['chrisbrown', 'KendallJenner']|kendalljexnner wooo enjoy weirdness dmxab tcj
374|['chrisbrown', 'KendallJenner']|mpppg heartbreakonafullmoontour tickets fccn obfkit agi
375|['chrisbrown', 'KendallJenner']|nav tickets fccn obfkit agi weirdness
376|['KendallJenner', 'ArianaGrande']|mhiiddeolq xglqxs kendallandkylieforovs wzyq bxhiq thoughts
377|['KendallJenner', 'chrisbrown']|jimmyfallon nbd seeeeee yoooouuuu tonight arianaonfallon
378|['chrisbrown', 'KendallJenner']|kardashianukfan kendall horses kardashianukfan kendall horses
379|['chrisbrown', 'KendallJenner']|mhiiddeolq fccn obfkit agi ready rhaxgpwsft
380|['chrisbrown', 'KendallJenner']|nav tickets fccn obfkit agi mpppg
381|['KendallJenner', 'Zendaya']|fccn obfkit agi yup expoi rhaxgpwsft
382|['Zendaya', 'NASA']|select ovspeople stores xglqxs kendallandkylieforovs wzyq
383|['NASA', 'JLo']|provide plentiful energy future robotic human
384|['NASA', 'chrisbrown']|human tissue fruit flies find rbsnxahmyw
385|['chrisbrown', 'KendallJenner']|recently international space station manages tasks
386|['chrisbrown', 'KendallJenner']|stores xglqxs kendallandkylieforovs wzyq bxhiq njbbhqj
387|['chrisbrown', 'KendallJenner']|obfkit agi heartbreakonafullmoontour tickets fccn obfkit
388|['chrisbrown', 'KendallJenner']|thoughts kffiunh heartbreakonafullmoontour tickets fccn obfkit
389|['chrisbrown', 'KendallJenner']|enjoy weirdness dmxab tcj obfkit agi
390|['chrisbrown', 'KendallJenner']|tickets fccn obfkit agi tcu ovspeople
391|['KendallJenner', 'NFL']|idontdie joynerlucas jbeex mpppg mpppg idontdie
392|['KendallJenner', 'chrisbrown']|njbbhqj jaguars cjebdybrxq harrisonnfl rjpn nfldraft
393|['chrisbrown', 'KendallJenner']|bxhiq joynerlucas jbeex wzyq bxhiq die
394|['KendallJenner', 'ConanOBrien']|tickets fccn obfkit agi heartbreakonafullmoontour tickets
395|['KendallJenner', 'chrisbrown']|tortured memories movie plays computer hacker
396|['chrisbrown', 'wizkhalifa']|kardashianukfan kendall horses gagjixzo njbbhqj stores
397|['chrisbrown', 'KendallJenner']|bjqxz heartbreakonafullmoontour tickets fccn obfkit agi
398|['chrisbrown', 'KendallJenner']|rhaxgpwsft die thoughts kffiunh agi kffiunh
399|['chrisbrown', 'KendallJenner']|bxhiq angelkendallj archived idontdie joynerlucas jbeex
400|['chrisbrown', 'KendallJenner']|rhaxgpwsft fccn obfkit agi kylie select
401|['chrisbrown', 'KendallJenner']|kendallandkylieforovs wzyq bxhiq fccn obfkit agi
402|['chrisbrown', 'KendallJenner']|tcj ovspeople stores xglqxs kendallandkylieforovs wzyq
403|['chrisbrown', 'KendallJenner']|kfwnizyunp gyrcss nav archived tune gagjixzo
404|['chrisbrown', 'KendallJenner']|uabum oxd oxd gagjixzo njbbhqj gagjixzo
405|['chrisbrown', 'KendallJenner']|rhaxgpwsft die thoughts kffiunh angelkendallj archived
406|['chrisbrown', 'KendallJenner']|kkszkazhfd angelkendallj archived idontdie joynerlucas jbeex
407|['chrisbrown', 'KendallJenner']|die thoughts kffiunh kfwnizyunp fccn obfkit
408|['KendallJenner', 'aliciakeys']|wvs kkszkazhfd tune gagjixzo njbbhqj xglqxs
409|['KendallJenner', 'chrisbrown']|wooo wzyq bxhiq weirdness dmxab tcj
410|['chrisbrown', 'KendallJenner']|kffiunh kylie select ovspeople stores xglqxs
411|['chrisbrown', 'KendallJenner']|kardashianukfan kendall horses heartbreakonafullmoontour tickets fccn
412|['chrisbrown', 'KendallJenner']|oxd oxd archived kendalljexnner wooo thoughts
413|['chrisbrown', 'KendallJenner']|kendalljexnner wooo enjoy weirdness dmxab tcj
414|['chrisbrown', 'KendallJenner']|tcu joynerlucas jbeex kardashianukfan kendall horses
415|['KendallJenner', 'NASA']|tcj fccn obfkit agi kendall kylie
416|['KendallJenner', 'chrisbrown']|robotic human space station manages tasks
417|['chrisbrown', 'KendallJenner']|weirdness dmxab tcj iiqwhhpyqj idontdie joynerlucas
418|['chrisbrown', 'KendallJenner']|kendallandkylieforovs wzyq bxhiq rhaxgpwsft mhiiddeolq mhiiddeolq
419|['chrisbrown', 'KendallJenner']|obfkit agi heartbreakonafullmoontour tickets fccn obfkit
420|['chrisbrown', 'KendallJenner']|jbeex gagjixzo njbbhqj ready rhaxgpwsft rhaxgpwsft
421|['KendallJenner', 'tyrabanks']|select ovspeople stores xglqxs kendallandkylieforovs wzyq
422|['KendallJenner', 'chrisbrown']|yup expoi gyrcss nav bxhiq reply
423|['chrisbrown', 'KendallJenner']|oxd angelkendallj archived kkszkazhfd fccn obfkit
424|['KendallJenner', 'selenagomez']|oxd bxhiq tickets fccn obfkit agi
425|['selenagomez', 'RyanSeacrest']|tune gagjixzo njbbhqj nav part reasonswhy
426|['selenagomez', 'chrisbrown']|winter test passed waiting iiwufn tanyarad
427|['chrisbrown', 'KendallJenner']|jbeex wvs kkszkazhfd fccn obfkit agi
428|['chrisbrown', 'KendallJenner']|nav nhb tickets fccn obfkit agi
429|['KendallJenner', 'kobebryant']|kendall kylie select ovspeople stores xglqxs
430|['KendallJenner', 'chrisbrown']|detail hkybf game espn app utahjazz
431|['chrisbrown', 'BigSean']|stores xglqxs kendallandkylieforovs wzyq bxhiq njbbhqj
432|['chrisbrown', 'KendallJenner']|dropped twenty timeless shau voelt joynerlucas
433|['chrisbrown', 'KendallJenner']|dmxab tcj kendallandkylieforovs wzyq bxhiq expoi
434|['chrisbrown', 'KendallJenner']|wooo gagjixzo njbbhqj idontdie joynerlucas jbeex
435|['chrisbrown', 'KendallJenner']|kendall kylie select ovspeople stores xglqxs
436|['chrisbrown', 'KendallJenner']|oxd archived ovspeople stores xglqxs kendallandkylieforovs
437|['chrisbrown', 'KendallJenner']|fccn obfkit agi ukeehy tcu wvs
438|['chrisbrown', 'KendallJenner']|iiqwhhpyqj xglqxs kendallandkylieforovs wzyq bxhiq wooo
439|['chrisbrown', 'KendallJenner']|kendallandkylieforovs wzyq bxhiq ready rhaxgpwsft kendalljexnner
440|['chrisbrown', 'KendallJenner']|tickets fccn obfkit agi fccn obfkit
441|['chrisbrown', 'KendallJenner']|jbeex fccn obfkit agi dmxab tcj
442|['KendallJenner', 'LeoDiCaprio']|heartbreakonafullmoontour tickets fccn obfkit agi kkszkazhfd
443|['KendallJenner', 'chrisbrown']|gyrcss nav poverty learn ecmwdvksx dliynuiqy
444|['chrisbrown', 'KendallJenner']|wvs kkszkazhfd ukeehy tcu kfwnizyunp kendallandkylieforovs
445|['chrisbrown', 'KendallJenner']|dmxab tcj stores xglqxs kendallandkylieforovs wzyq
446|['chrisbrown', 'KendallJenner']|gagjixzo njbbhqj rhaxgpwsft archived ovspeople stores
447|['KendallJenner', 'LilTunechi']|wooo idontdie joynerlucas jbeex gagjixzo njbbhqj
448|['KendallJenner', 'chrisbrown']|gagjixzo njbbhqj tapjkyj page tag friends
449|['chrisbrown', 'KendallJenner']|wvs kkszkazhfd fccn obfkit agi tickets
450|['chrisbrown', 'KendallJenner']|horses enjoy weirdness dmxab tcj kkszkazhfd
451|['chrisbrown', 'KendallJenner']|jbeex select ovspeople stores xglqxs kendallandkylieforovs
452|['chrisbrown', 'KendallJenner']|kardashianukfan kendall horses ready rhaxgpwsft gagjixzo
453|['KendallJenner', 'ArianaGrande']|njbbhqj fccn obfkit agi tcj ukeehy
454|['KendallJenner', 'chrisbrown']|kylie select ovspeople stores xglqxs kendallandkylieforovs
455|['chrisbrown', 'KendallJenner']|dont die thoughts kffiunh wvs kkszkazhfd
456|['chrisbrown', 'KendallJenner']|expoi stores xglqxs kendallandkylieforovs wzyq bxhiq
457|['KendallJenner', 'aplusk']|jbeex heartbreakonafullmoontour tickets fccn obfkit agi
458|['aplusk', 'Oprah']|trafficking hookers shows lack empathy understanding
459|['Oprah', 'chrisbrown']|conversation streams facebook page tomorrow rmqipi
460|['chrisbrown', 'KendallJenner']|idontdie joynerlucas jbeex read article issue
461|['chrisbrown', 'KendallJenner']|rhaxgpwsft expoi ovspeople stores xglqxs kendallandkylieforovs
462|['chrisbrown', 'KendallJenner']|idontdie joynerlucas jbeex fccn obfkit agi
463|['KendallJenner', 'LeoDiCaprio']|gagjixzo njbbhqj kkszkazhfd wvs kkszkazhfd thoughts
464|['KendallJenner', 'chrisbrown']|jagpacqnba dmxab tcj excited join father
465|['chrisbrown', 'KendallJenner']|mpppg select ovspeople stores xglqxs kendallandkylieforovs
466|['chrisbrown', 'KendallJenner']|wvs kkszkazhfd nhb dmxab tcj kffiunh
467|['KendallJenner', 'Usher']|njbbhqj ovspeople stores xglqxs kendallandkylieforovs wzyq
468|['KendallJenner', 'chrisbrown']|tcj wsfllc qar pwktrq pwktrq oxd
469|['chrisbrown', 'KendallJenner']|kardashianukfan kendall horses uabum oxd kendalljexnner
470|['chrisbrown', 'KendallJenner']|weirdness dmxab tcj archived gyrcss nav
471|['chrisbrown', 'KendallJenner']|tickets fccn obfkit agi tickets fccn
472|['chrisbrown', 'KendallJenner']|nav tickets fccn obfkit agi dmxab
473|['chrisbrown', 'KendallJenner']|nhb tickets fccn obfkit agi kendalljexnner
474|['KendallJenner', 'NASA']|kffiunh mpppg enjoy weirdness dmxab tcj
475|['KendallJenner', 'chrisbrown']|tomorrow starting hear results questions answered
476|['chrisbrown', 'KendallJenner']|ready rhaxgpwsft kylie select ovspeople stores
477|['KendallJenner', 'aliciakeys']|thoughts kffiunh fccn obfkit agi die
478|['aliciakeys', 'kourtneykardash']|dmxab tcj kfwnizyunp weirdness dmxab tcj
479|['kourtneykardash', 'TheEllenShow']|ready ojkdjzazjr freezer poamkiroy janellemonae ieb
480|['kourtneykardash', 'chrisbrown']|spicy round nsync word posh spice
481|['chrisbrown', 'KendallJenner']|nhb kmkpqrftpj green smoothie bowls breakfast
482|['chrisbrown', 'KendallJenner']|angelkendallj archived obfkit agi heartbreakonafullmoontour tickets
483|['chrisbrown', 'KendallJenner']|tcu nav wvs kkszkazhfd wvs kkszkazhfd
484|['chrisbrown', 'KendallJenner']|bxhiq select ovspeople stores xglqxs kendallandkylieforovs
485|['KendallJenner', 'SnoopDogg']|nav thoughts kffiunh heartbreakonafullmoontour tickets fccn
486|['KendallJenner', 'chrisbrown']|wzyq bxhiq industry ylsravdvch wgsx enjoy
487|['chrisbrown', 'selenagomez']|gagjixzo njbbhqj uabum oxd expoi dmxab
488|['chrisbrown', 'KendallJenner']|backtoyou part reasonswhy soundtrack excited guys
489|['chrisbrown', 'KendallJenner']|idontdie joynerlucas jbeex yup expoi ovspeople
490|['chrisbrown', 'KendallJenner']|bxhiq expoi expoi tcj ready rhaxgpwsft
491|['KendallJenner', 'SnoopDogg']|tickets fccn obfkit agi fccn obfkit
492|['KendallJenner', 'chrisbrown']|dmxab tcj yall tune tonite jokerswild
493|['chrisbrown', 'KendallJenner']|obfkit agi tickets fccn obfkit agi
494|['chrisbrown', 'KendallJenner']|kardashianukfan kendall horses stores xglqxs kendallandkylieforovs
495|['chrisbrown', 'KendallJenner']|expoi gagjixzo njbbhqj kendall kylie select
496|['chrisbrown', 'KendallJenner']|mhiiddeolq fccn obfkit agi archived mpppg
497|['KendallJenner', 'iamwill']|dmxab tcj stores xglqxs kendallandkylieforovs wzyq
498|['KendallJenner', 'chrisbrown']|promotes drugs amp crime education izirqis
499|['chrisbrown', 'KendallJenner']|wvs kkszkazhfd angelkendallj archived gagjixzo njbbhqj
500|['chrisbrown', 'KendallJenner']|select ovspeople stores xglqxs kendallandkylieforovs wzyq
501|['chrisbrown', 'KendallJenner']|gagjixzo njbbhqj gyrcss nav kardashianukfan kendall
502|['chrisbrown', 'KendallJenner']|rhaxgpwsft wooo kendalljexnner wooo rhaxgpwsft tickets
503|['chrisbrown', 'KendallJenner']|idontdie joynerlucas jbeex kardashianukfan kendall horses
504|['chrisbrown', 'KendallJenner']|stores xglqxs kendallandkylieforovs wzyq bxhiq njbbhqj
505|['chrisbrown', 'KendallJenner']|kffiunh wvs kkszkazhfd archived horses njbbhqj
506|['KendallJenner', 'wizkhalifa']|kffiunh stores xglqxs kendallandkylieforovs wzyq bxhiq
507|['wizkhalifa', 'britneyspears']|bruce leefa westworld style dad hats
508|['wizkhalifa', 'chrisbrown']|day dancing tqnnszwdiu bro told iwhr
509|['chrisbrown', 'KendallJenner']|phone xycx bjqxz album champ txt
510|['chrisbrown', 'KendallJenner']|kendallandkylieforovs wzyq bxhiq tcu njbbhqj stores
511|['KendallJenner', 'nytimes']|xglqxs kendallandkylieforovs wzyq bxhiq kendall kylie
512|['KendallJenner', 'chrisbrown']|promote hair growth trump aides staged
513|['chrisbrown', 'KendallJenner']|kkszkazhfd iiqwhhpyqj wvs kkszkazhfd tickets fccn
514|['KendallJenner', 'WSJ']|kendallandkylieforovs wzyq bxhiq horses bxhiq rhaxgpwsft
515|['KendallJenner', 'chrisbrown']|presence south korea matter korea alliance
516|['chrisbrown', 'LilTunechi']|jbeex gyrcss nav ukeehy tcu obfkit
517|['chrisbrown', 'KendallJenner']|mpppg meet pryme celebrating youngmoneyapaa draft
518|['chrisbrown', 'KendallJenner']|weirdness dmxab tcj ovspeople stores xglqxs
519|['chrisbrown', 'KendallJenner']|horses stores xglqxs kendallandkylieforovs wzyq bxhiq
520|['KendallJenner', 'RyanSeacrest']|kendall kylie select ovspeople stores xglqxs
521|['KendallJenner', 'chrisbrown']|couple kellyripa markconsuelos happy year kellyripa
522|['chrisbrown', 'KendallJenner']|tickets fccn obfkit agi uabum oxd
523|['chrisbrown', 'KendallJenner']|mhiiddeolq ready rhaxgpwsft enjoy weirdness dmxab
524|['KendallJenner', 'NASA']|tune gagjixzo njbbhqj horses horses heartbreakonafullmoontour
525|['KendallJenner', 'chrisbrown']|mild meteor shower visible dawn check
526|['chrisbrown', 'KendallJenner']|horses yup expoi fccn obfkit agi
527|['chrisbrown', 'KendallJenner']|oxd agi mhiiddeolq kkszkazhfd dmxab tcj
528|['chrisbrown', 'KendallJenner']|expoi wzyq bxhiq fccn obfkit agi
529|['chrisbrown', 'KendallJenner']|tcj kkszkazhfd dont die thoughts kffiunh
530|['KendallJenner', 'jtimberlake']|heartbreakonafullmoontour tickets fccn obfkit agi thoughts
531|['KendallJenner', 'chrisbrown']|time round tonight theforum wkoogce theforum
532|['chrisbrown', 'KendallJenner']|iiqwhhpyqj iiqwhhpyqj dont die thoughts kffiunh
533|['chrisbrown', 'KendallJenner']|tune gagjixzo njbbhqj kkszkazhfd dont die
534|['chrisbrown', 'KendallJenner']|wooo kkszkazhfd rhaxgpwsft mpppg angelkendallj archived
535|['chrisbrown', 'KendallJenner']|enjoy weirdness dmxab tcj wzyq bxhiq
536|['chrisbrown', 'KendallJenner']|idontdie joynerlucas jbeex uabum oxd nhb
537|['chrisbrown', 'KendallJenner']|gagjixzo njbbhqj gagjixzo njbbhqj yup expoi
538|['chrisbrown', 'KendallJenner']|rhaxgpwsft weirdness dmxab tcj ukeehy tcu
539|['KendallJenner', 'katyperry']|stores xglqxs kendallandkylieforovs wzyq bxhiq kffiunh
540|['katyperry', 'taylorswift13']|share meaningful transcendental meditation hope learn
541|['katyperry', 'chrisbrown']|iheartradio music awards tbsnetwork hhili bwn
542|['chrisbrown', 'KendallJenner']|jbeex tickets fccn obfkit agi prince
543|['chrisbrown', 'KendallJenner']|kylie select ovspeople stores xglqxs kendallandkylieforovs
544|['chrisbrown', 'KendallJenner']|wooo agi heartbreakonafullmoontour tickets fccn obfkit
545|['chrisbrown', 'KendallJenner']|kendall kylie select ovspeople stores xglqxs
546|['chrisbrown', 'KendallJenner']|stores xglqxs kendallandkylieforovs wzyq bxhiq heartbreakonafullmoontour
547|['chrisbrown', 'KendallJenner']|agi heartbreakonafullmoontour tickets fccn obfkit agi
548|['chrisbrown', 'KendallJenner']|fccn obfkit agi die thoughts kffiunh
549|['chrisbrown', 'KendallJenner']|tcu angelkendallj archived nav uabum oxd
550|['chrisbrown', 'KendallJenner']|gagjixzo njbbhqj gyrcss nav iiqwhhpyqj rhaxgpwsft
551|['KendallJenner', 'Diddy']|tcu dont die thoughts kffiunh kfwnizyunp
552|['Diddy', 'katyperry']|jitc sxaol back work season thefour
553|['katyperry', 'chrisbrown']|inspired amp encouraged today amp grateful
554|['chrisbrown', 'KendallJenner']|mhiiddeolq dopey sleepy week americanidol mzeemr
555|['chrisbrown', 'KendallJenner']|kylie select ovspeople stores xglqxs kendallandkylieforovs
556|['chrisbrown', 'KendallJenner']|mpppg rhaxgpwsft uabum oxd angelkendallj archived
557|['chrisbrown', 'KendallJenner']|jbeex nav kendallandkylieforovs wzyq bxhiq expoi
558|['chrisbrown', 'KendallJenner']|kendalljexnner wooo angelkendallj archived xglqxs kendallandkylieforovs
559|['chrisbrown', 'KendallJenner']|kendalljexnner wooo idontdie joynerlucas jbeex die
560|['chrisbrown', 'KendallJenner']|weirdness dmxab tcj thoughts kffiunh kfwnizyunp
561|['chrisbrown', 'KendallJenner']|mhiiddeolq select ovspeople stores xglqxs kendallandkylieforovs
562|['KendallJenner', 'ZacEfron']|dmxab tcj angelkendallj archived thoughts kffiunh
563|['KendallJenner', 'chrisbrown']|tune gagjixzo njbbhqj gyrcss nav yup
564|['chrisbrown', 'KendallJenner']|kylie select ovspeople stores xglqxs kendallandkylieforovs
565|['chrisbrown', 'KendallJenner']|nav kffiunh mhiiddeolq oxd kendalljexnner wooo
566|['chrisbrown', 'KendallJenner']|uabum oxd wzyq bxhiq agi kendalljexnner
567|['chrisbrown', 'KendallJenner']|tickets fccn obfkit agi wvs kkszkazhfd
568|['chrisbrown', 'KendallJenner']|ukeehy tcu yup expoi select ovspeople
569|['KendallJenner', 'ddlovato']|bxhiq dmxab tcj dont die thoughts
570|['ddlovato', 'MileyCyrus']|kvhq grateful closest left side love
571|['MileyCyrus', 'chrisbrown']|sis suggest conversexmiley converse hqswmhvlm headed
572|['chrisbrown', 'KendallJenner']|awesome fans part campaign pair conversexmiley
573|['chrisbrown', 'KendallJenner']|nav dmxab tcj tickets fccn obfkit
574|['chrisbrown', 'KendallJenner']|jbeex kendallandkylieforovs wzyq bxhiq uabum oxd
575|['chrisbrown', 'KendallJenner']|ready rhaxgpwsft nhb ukeehy tcu heartbreakonafullmoontour
576|['chrisbrown', 'KendallJenner']|wvs kkszkazhfd tickets fccn obfkit agi
577|['KendallJenner', 'aliciakeys']|wzyq bxhiq die thoughts kffiunh kendalljexnner
578|['KendallJenner', 'chrisbrown']|yup expoi tcj njbbhqj ieb egtk
579|['chrisbrown', 'KendallJenner']|ovspeople stores xglqxs kendallandkylieforovs wzyq bxhiq
580|['KendallJenner', 'KylieJenner']|kendall kylie select ovspeople stores xglqxs
581|['KendallJenner', 'chrisbrown']|bdaiohhxcv sxm cake ignigtuh today bdaiohhxcv
582|['chrisbrown', 'KendallJenner']|select ovspeople stores xglqxs kendallandkylieforovs wzyq
583|['KendallJenner', 'KylieJenner']|idontdie joynerlucas jbeex tcj horses idontdie
584|['KendallJenner', 'chrisbrown']|site bdaiohhxcv sxm yayyyy bronze life
585|['chrisbrown', 'KendallJenner']|kendalljexnner wooo tcu expoi xglqxs kendallandkylieforovs
586|['chrisbrown', 'KendallJenner']|wzyq bxhiq select ovspeople stores xglqxs
587|['chrisbrown', 'KendallJenner']|kendalljexnner wooo kffiunh njbbhqj nav tcu
588|['chrisbrown', 'KendallJenner']|gagjixzo njbbhqj tickets fccn obfkit agi
589|['chrisbrown', 'KendallJenner']|nhb kylie select ovspeople stores xglqxs
590|['chrisbrown', 'KendallJenner']|archived rhaxgpwsft ready rhaxgpwsft expoi kfwnizyunp
591|['chrisbrown', 'KendallJenner']|wzyq bxhiq ovspeople stores xglqxs kendallandkylieforovs
592|['chrisbrown', 'KendallJenner']|weirdness dmxab tcj dmxab tcj weirdness
593|['chrisbrown', 'KendallJenner']|rhaxgpwsft kkszkazhfd kkszkazhfd horses tcu horses
594|['chrisbrown', 'KendallJenner']|die thoughts kffiunh kendall kylie select
595|['KendallJenner', 'JimCarrey']|thoughts kffiunh heartbreakonafullmoontour tickets fccn obfkit
596|['KendallJenner', 'chrisbrown']|sheep clothing inwardly ravenous wolves matthew
597|['chrisbrown', 'KendallJenner']|dont die thoughts kffiunh archived ukeehy
598|['chrisbrown', 'KendallJenner']|rhaxgpwsft stores xglqxs kendallandkylieforovs wzyq bxhiq
599|['KendallJenner', 'ladygaga']|rhaxgpwsft wvs kkszkazhfd nav mhiiddeolq kendall
600|['KendallJenner', 'chrisbrown']|celebrating love desert dry thirsty music
601|['chrisbrown', 'POTUS44']|enjoy weirdness dmxab tcj kendall kylie
602|['chrisbrown', 'KendallJenner']|love country change americans owe great
603|['chrisbrown', 'KendallJenner']|ready rhaxgpwsft enjoy weirdness dmxab tcj
604|['chrisbrown', 'KendallJenner']|mhiiddeolq bxhiq wzyq bxhiq tcj tcu
605|['KendallJenner', 'funnyordie']|wooo obfkit agi gyrcss nav kendalljexnner
606|['funnyordie', 'BillGates']|guy olqxsegn war times row reviews
607|['BillGates', 'funnyordie']|shared responsibility ensure children matter live
608|['BillGates', 'chrisbrown']|effective scalable approach saving children lives
609|['chrisbrown', 'RyanSeacrest']|live shot life vaccineswork giqifsxuh heartbreakonafullmoontour
610|['RyanSeacrest', 'danieltosh']|time flies happy anniversary kellyripa kellyandryan
611|['RyanSeacrest', 'chrisbrown']|anniversary kellyripa kellyandryan wmtng urai asked
612|['chrisbrown', 'KendallJenner']|kkszkazhfd welcoming fam happy year kellyripa
613|['chrisbrown', 'KendallJenner']|expoi archived thoughts kffiunh oxd archived
614|['chrisbrown', 'KendallJenner']|kardashianukfan kendall horses mhiiddeolq idontdie joynerlucas
615|['KendallJenner', 'Zendaya']|obfkit agi weirdness dmxab tcj mpppg
616|['KendallJenner', 'chrisbrown']|boohoo zoeygrossman luxurylaw xmokrcuxfh preparing walk
617|['chrisbrown', 'KendallJenner']|expoi wzyq bxhiq archived ukeehy tcu
618|['chrisbrown', 'KendallJenner']|bxhiq mpppg fccn obfkit agi wzyq
619|['chrisbrown', 'KendallJenner']|dont die thoughts kffiunh ovspeople stores
620|['chrisbrown', 'KendallJenner']|ready rhaxgpwsft tcj ovspeople stores xglqxs
621|['chrisbrown', 'KendallJenner']|jbeex oxd stores xglqxs kendallandkylieforovs wzyq
622|['KendallJenner', 'MariahCarey']|die thoughts kffiunh expoi wooo kfwnizyunp
623|['KendallJenner', 'chrisbrown']|dates visit ohpg lxsk kpslpo pvl
624|['chrisbrown', 'KendallJenner']|xglqxs kendallandkylieforovs wzyq bxhiq archived rhaxgpwsft
625|['chrisbrown', 'KendallJenner']|enjoy weirdness dmxab tcj xglqxs kendallandkylieforovs
626|['chrisbrown', 'KendallJenner']|nhb kardashianukfan kendall horses jbeex die
627|['chrisbrown', 'KendallJenner']|kardashianukfan kendall horses nhb die thoughts
628|['chrisbrown', 'KendallJenner']|idontdie joynerlucas jbeex agi die thoughts
629|['chrisbrown', 'KendallJenner']|dmxab tcj yup expoi angelkendallj archived
630|['chrisbrown', 'KendallJenner']|heartbreakonafullmoontour tickets fccn obfkit agi nhb
631|['chrisbrown', 'KendallJenner']|obfkit agi heartbreakonafullmoontour tickets fccn obfkit
632|['KendallJenner', 'SnoopDogg']|enjoy weirdness dmxab tcj kylie select
