0|['KendallJenner', 'chrisbrown']|dmxab tcj ready rhaxgpwsft gyrcss nav
1|['chrisbrown', 'KendallJenner']|ready rhaxgpwsft fccn obfkit agi nav
2|['chrisbrown', 'KendallJenner']|kardashianukfan kendall horses kkszkazhfd njbbhqj mhiiddeolq
3|['KendallJenner', 'chrisbrown']|iiqwhhpyqj kardashianukfan kendall horses mhiiddeolq kendall
4|['chrisbrown', 'KendallJenner']|kkszkazhfd wvs kkszkazhfd oxd ready rhaxgpwsft
5|['chrisbrown', 'KendallJenner']|heartbreakonafullmoontour tickets fccn obfkit agi thoughts
6|['chrisbrown', 'KendallJenner']|fccn obfkit agi mpppg rhaxgpwsft stores
7|['chrisbrown', 'KendallJenner']|dmxab tcj kendall kylie select ovspeople
8|['KendallJenner', 'PlayStation']|weirdness dmxab tcj oxd nav kffiunh
9|['KendallJenner', 'chrisbrown']|champion paladins exits beta scy kdahi
10|['chrisbrown', 'KendallJenner']|kardashianukfan kendall horses kendalljexnner wooo kkszkazhfd
11|['KendallJenner', 'chrisbrown']|oxd kylie select ovspeople stores xglqxs
12|['KendallJenner', 'chrisbrown']|wooo enjoy weirdness dmxab tcj xglqxs
13|['KendallJenner', 'chrisbrown']|ovspeople stores xglqxs kendallandkylieforovs wzyq bxhiq
14|['KendallJenner', 'chrisbrown']|fccn obfkit agi tcu kendallandkylieforovs wzyq
15|['KendallJenner', 'chrisbrown']|tickets fccn obfkit agi mhiiddeolq angelkendallj
16|['KendallJenner', 'chrisbrown']|stores xglqxs kendallandkylieforovs wzyq bxhiq kfwnizyunp
17|['KendallJenner', 'chrisbrown']|dont die thoughts kffiunh tcj ovspeople
18|['KendallJenner', 'chrisbrown']|oxd kardashianukfan kendall horses jbeex fccn
19|['KendallJenner', 'chrisbrown']|angelkendallj archived yup expoi dont die
20|['KendallJenner', 'chrisbrown']|gyrcss nav oxd nav gyrcss nav
21|['chrisbrown', 'SHAQ']|fccn obfkit agi gyrcss nav mhiiddeolq
22|['chrisbrown', 'KendallJenner']|crew theaters june uncledrewfilm detncuexdz detncuexdz
23|['KendallJenner', 'chrisbrown']|obfkit agi die thoughts kffiunh jbeex
24|['KendallJenner', 'chrisbrown']|fccn obfkit agi njbbhqj dont die
25|['KendallJenner', 'chrisbrown']|ukeehy tcu ovspeople stores xglqxs kendallandkylieforovs
26|['KendallJenner', 'chrisbrown']|kfwnizyunp bxhiq yup expoi yup expoi
27|['KendallJenner', 'chrisbrown']|fccn obfkit agi kendall kylie select
28|['KendallJenner', 'chrisbrown']|wzyq bxhiq joynerlucas jbeex kendall kylie
29|['KendallJenner', 'chrisbrown']|kendallandkylieforovs wzyq bxhiq bxhiq ovspeople stores
30|['KendallJenner', 'chrisbrown']|nhb weirdness dmxab tcj uabum oxd
31|['KendallJenner', 'chrisbrown']|enjoy weirdness dmxab tcj rhaxgpwsft agi
32|['KendallJenner', 'chrisbrown']|mhiiddeolq select ovspeople stores xglqxs kendallandkylieforovs
33|['KendallJenner', 'chrisbrown']|gagjixzo njbbhqj xglqxs kendallandkylieforovs wzyq bxhiq
34|['KendallJenner', 'chrisbrown']|rhaxgpwsft ovspeople stores xglqxs kendallandkylieforovs wzyq
35|['KendallJenner', 'chrisbrown']|expoi tcu wooo kendallandkylieforovs wzyq bxhiq
36|['KendallJenner', 'chrisbrown']|gyrcss nav enjoy weirdness dmxab tcj
37|['chrisbrown', 'kourtneykardash']|bxhiq tune gagjixzo njbbhqj dont die
38|['chrisbrown', 'KendallJenner']|ready ojkdjzazjr tickets fccn obfkit agi
39|['KendallJenner', 'chrisbrown']|joynerlucas jbeex kffiunh kardashianukfan kendall horses
40|['KendallJenner', 'chrisbrown']|fccn obfkit agi tcu njbbhqj tune
41|['KendallJenner', 'chrisbrown']|tcu bxhiq iiqwhhpyqj iiqwhhpyqj uabum oxd
42|['KendallJenner', 'chrisbrown']|dmxab tcj horses tcj oxd iiqwhhpyqj
43|['KendallJenner', 'chrisbrown']|yup expoi wooo tickets fccn obfkit
44|['KendallJenner', 'chrisbrown']|kendallandkylieforovs wzyq bxhiq stores xglqxs kendallandkylieforovs
45|['KendallJenner', 'chrisbrown']|xglqxs kendallandkylieforovs wzyq bxhiq jbeex heartbreakonafullmoontour
46|['KendallJenner', 'chrisbrown']|ovspeople stores xglqxs kendallandkylieforovs wzyq bxhiq
47|['KendallJenner', 'chrisbrown']|obfkit agi tcu archived dmxab tcj
48|['chrisbrown', 'FoxNews']|wooo die thoughts kffiunh iiqwhhpyqj kkszkazhfd
49|['chrisbrown', 'KendallJenner']|agi real consequences russia acts aggression
50|['KendallJenner', 'chrisbrown']|archived enjoy weirdness dmxab tcj ukeehy
51|['chrisbrown', 'blakeshelton']|mpppg horses dont die thoughts kffiunh
52|['blakeshelton', 'SnoopDogg']|kffiunh place olerednashville nvvhmen smithworksvodka pydmwb
53|['SnoopDogg', 'KendallJenner']|tonite jokerswild yis yam big things
54|['KendallJenner', 'ashleytisdale']|bxhiq jokerswild ueqk ypgf ueqk ypgf
55|['KendallJenner', 'chrisbrown']|kzuafvrbn wzyq bxhiq wzyq bxhiq ovspeople
56|['chrisbrown', 'aplusk']|agi rhaxgpwsft kfwnizyunp bxhiq ukeehy tcu
57|['chrisbrown', 'KendallJenner']|lack empathy understanding issue educate wggnyub
58|['KendallJenner', 'tomhanks']|angelkendallj archived kfwnizyunp uabum oxd weirdness
59|['KendallJenner', 'chrisbrown']|lhszhw njbbhqj movie shooting baton rouge
60|['chrisbrown', 'kanyewest']|tickets fccn obfkit agi ukeehy tcu
61|['chrisbrown', 'KendallJenner']|started today title overground hell road
62|['KendallJenner', 'chrisbrown']|kffiunh wzyq bxhiq archived mhiiddeolq thoughts
63|['chrisbrown', 'NBA']|wvs kkszkazhfd kffiunh kendalljexnner wooo ukeehy
64|['NBA', 'HillaryClinton']|iiqwhhpyqj orleans dubnation nbaplayoffs hvqczu sgy
65|['NBA', 'KendallJenner']|literacy fun check akxiywenm lot reading
66|['KendallJenner', 'chrisbrown']|lebron james pts ast reb posts
67|['KendallJenner', 'chrisbrown']|kardashianukfan kendall horses tcu expoi dmxab
68|['KendallJenner', 'chrisbrown']|tcj jbeex gyrcss nav tickets fccn
69|['KendallJenner', 'chrisbrown']|joynerlucas jbeex fccn obfkit agi heartbreakonafullmoontour
70|['chrisbrown', 'xtina']|jbeex heartbreakonafullmoontour tickets fccn obfkit agi
71|['chrisbrown', 'KendallJenner']|rjzmso heartbreakonafullmoontour tickets fccn obfkit agi
72|['KendallJenner', 'Oprah']|bxhiq die thoughts kffiunh mhiiddeolq dont
73|['KendallJenner', 'chrisbrown']|pacnow selfinspiredluv faaavorite line movie secret
74|['chrisbrown', 'ABC']|select ovspeople stores xglqxs kendallandkylieforovs wzyq
75|['chrisbrown', 'KendallJenner']|princess charlotte celebrates birthday today moment
76|['KendallJenner', 'chrisbrown']|tcj xglqxs kendallandkylieforovs wzyq bxhiq kfwnizyunp
77|['KendallJenner', 'chrisbrown']|kendallandkylieforovs wzyq bxhiq nhb jbeex fccn
78|['chrisbrown', 'maroon5']|weirdness dmxab tcj mhiiddeolq mpppg kylie
79|['chrisbrown', 'KendallJenner']|iiqwhhpyqj mpppg heartbreakonafullmoontour tickets fccn obfkit
80|['KendallJenner', 'chrisbrown']|nhb kylie select ovspeople stores xglqxs
81|['chrisbrown', 'Pink']|tcu nav select ovspeople stores xglqxs
82|['chrisbrown', 'KendallJenner']|wmefmhuwe coming hot txkuzaq night mad
83|['KendallJenner', 'BrunoMars']|uabum oxd kardashianukfan kendall horses thoughts
84|['KendallJenner', 'chrisbrown']|rip met amp meant lot father
85|['KendallJenner', 'chrisbrown']|expoi heartbreakonafullmoontour tickets fccn obfkit agi
86|['KendallJenner', 'chrisbrown']|rhaxgpwsft kardashianukfan kendall horses mhiiddeolq rhaxgpwsft
87|['chrisbrown', 'KendallJenner']|archived rhaxgpwsft tickets fccn obfkit agi
88|['KendallJenner', 'chrisbrown']|kkszkazhfd jbeex enjoy weirdness dmxab tcj
89|['chrisbrown', 'KendallJenner']|jbeex agi rhaxgpwsft yup expoi jbeex
90|['KendallJenner', 'chrisbrown']|kendall kylie select ovspeople stores xglqxs
91|['KendallJenner', 'chrisbrown']|idontdie joynerlucas jbeex archived dont die
92|['KendallJenner', 'chrisbrown']|kendalljexnner wooo angelkendallj archived wzyq bxhiq
93|['KendallJenner', 'chrisbrown']|tickets fccn obfkit agi uabum oxd
94|['KendallJenner', 'chrisbrown']|kylie select ovspeople stores xglqxs kendallandkylieforovs
95|['KendallJenner', 'chrisbrown']|fccn obfkit agi enjoy weirdness dmxab
96|['chrisbrown', 'KendallJenner']|tickets fccn obfkit agi ukeehy tcu
97|['KendallJenner', 'chrisbrown']|gagjixzo njbbhqj wzyq bxhiq select ovspeople
98|['chrisbrown', 'ParisHilton']|nhb enjoy weirdness dmxab tcj tcj
99|['chrisbrown', 'KendallJenner']|mhiiddeolq tickets fccn obfkit agi mhiiddeolq
100|['chrisbrown', 'KendallJenner']|wooo tickets fccn obfkit agi nav
101|['KendallJenner', 'chrisbrown']|kardashianukfan kendall horses kendallandkylieforovs wzyq bxhiq
102|['chrisbrown', 'ashleytisdale']|wooo oxd kardashianukfan kendall horses kendallandkylieforovs
103|['chrisbrown', 'KendallJenner']|tcu works sold love weather cozy
104|['KendallJenner', 'chrisbrown']|wzyq bxhiq jbeex select ovspeople stores
105|['KendallJenner', 'chrisbrown']|fccn obfkit agi gyrcss nav die
106|['KendallJenner', 'chrisbrown']|rhaxgpwsft mhiiddeolq nav tickets fccn obfkit
107|['KendallJenner', 'chrisbrown']|kendalljexnner wooo yup expoi njbbhqj obfkit
108|['KendallJenner', 'chrisbrown']|archived stores xglqxs kendallandkylieforovs wzyq bxhiq
109|['KendallJenner', 'chrisbrown']|mpppg kardashianukfan kendall horses horses ukeehy
110|['chrisbrown', 'NFL']|tickets fccn obfkit agi kylie select
111|['chrisbrown', 'KendallJenner']|week rookie make start fbfrefva dameshek
112|['KendallJenner', 'chrisbrown']|wvs kkszkazhfd tcj tickets fccn obfkit
113|['KendallJenner', 'chrisbrown']|mpppg enjoy weirdness dmxab tcj enjoy
114|['chrisbrown', 'KendallJenner']|tickets fccn obfkit agi rhaxgpwsft wooo
115|['KendallJenner', 'chrisbrown']|expoi gagjixzo njbbhqj kendallandkylieforovs wzyq bxhiq
116|['KendallJenner', 'chrisbrown']|xglqxs kendallandkylieforovs wzyq bxhiq expoi kardashianukfan
117|['KendallJenner', 'chrisbrown']|kffiunh tcj mpppg kendall kylie select
118|['KendallJenner', 'chrisbrown']|agi bxhiq mhiiddeolq enjoy weirdness dmxab
119|['KendallJenner', 'chrisbrown']|nav dmxab tcj tickets fccn obfkit
120|['chrisbrown', 'LeoDiCaprio']|xglqxs kendallandkylieforovs wzyq bxhiq kendall kylie
121|['LeoDiCaprio', 'katyperry']|key future fossil fuels kingoenergy technology
122|['LeoDiCaprio', 'KendallJenner']|americanidol disney themed prepare wigs fly
123|['KendallJenner', 'chrisbrown']|night learn eqp iaxtim eradicate energy
124|['KendallJenner', 'chrisbrown']|jbeex njbbhqj rhaxgpwsft angelkendallj archived oxd
125|['KendallJenner', 'chrisbrown']|die thoughts kffiunh weirdness dmxab tcj
126|['KendallJenner', 'chrisbrown']|oxd horses tune gagjixzo njbbhqj ovspeople
127|['KendallJenner', 'chrisbrown']|tcu oxd tcu yup expoi gagjixzo
128|['chrisbrown', 'WSJ']|rhaxgpwsft ukeehy tcu kendall kylie select
129|['chrisbrown', 'KendallJenner']|skip line ntfxd dhwb joynerlucas jbeex
130|['KendallJenner', 'chrisbrown']|die thoughts kffiunh njbbhqj thoughts kffiunh
131|['KendallJenner', 'chrisbrown']|tcu wvs kkszkazhfd jbeex njbbhqj kendall
132|['chrisbrown', 'britneyspears']|obfkit agi angelkendallj archived gagjixzo njbbhqj
133|['chrisbrown', 'KendallJenner']|upssl die thoughts kffiunh dreams made
134|['KendallJenner', 'ShawnMendes']|xglqxs kendallandkylieforovs wzyq bxhiq agi dmxab
135|['KendallJenner', 'chrisbrown']|stores xglqxs kendallandkylieforovs wzyq bxhiq tazqvm
136|['KendallJenner', 'chrisbrown']|kendallandkylieforovs wzyq bxhiq wzyq bxhiq heartbreakonafullmoontour
137|['KendallJenner', 'chrisbrown']|weirdness dmxab tcj tcu angelkendallj archived
138|['KendallJenner', 'chrisbrown']|ovspeople stores xglqxs kendallandkylieforovs wzyq bxhiq
139|['KendallJenner', 'chrisbrown']|heartbreakonafullmoontour tickets fccn obfkit agi thoughts
140|['KendallJenner', 'chrisbrown']|fccn obfkit agi kendalljexnner wooo die
141|['KendallJenner', 'chrisbrown']|kylie select ovspeople stores xglqxs kendallandkylieforovs
142|['KendallJenner', 'chrisbrown']|ready rhaxgpwsft agi tickets fccn obfkit
143|['KendallJenner', 'chrisbrown']|fccn obfkit agi fccn obfkit agi
144|['KendallJenner', 'chrisbrown']|tcu mpppg tcj jbeex mhiiddeolq jbeex
145|['KendallJenner', 'chrisbrown']|jbeex tickets fccn obfkit agi fccn
146|['chrisbrown', 'KDTrey5']|mpppg kardashianukfan kendall horses kardashianukfan kendall
147|['chrisbrown', 'KendallJenner']|tlxkligjdt hxh yuj bts shoot youtube
148|['KendallJenner', 'chrisbrown']|kendalljexnner wooo nhb kendall kylie select
149|['KendallJenner', 'chrisbrown']|njbbhqj tickets fccn obfkit agi kendallandkylieforovs
150|['KendallJenner', 'chrisbrown']|kendall kylie select ovspeople stores xglqxs
151|['KendallJenner', 'chrisbrown']|joynerlucas jbeex nav heartbreakonafullmoontour tickets fccn
152|['KendallJenner', 'chrisbrown']|tickets fccn obfkit agi horses kylie
153|['chrisbrown', 'KendallJenner']|kffiunh heartbreakonafullmoontour tickets fccn obfkit agi
154|['chrisbrown', 'KendallJenner']|archived dmxab tcj kendalljexnner wooo tune
155|['KendallJenner', 'chrisbrown']|weirdness dmxab tcj horses idontdie joynerlucas
156|['chrisbrown', 'blakeshelton']|angelkendallj archived tune gagjixzo njbbhqj fccn
157|['chrisbrown', 'KendallJenner']|nmm ready goodnight fnqwfta smithworksvodka pydmwb
158|['chrisbrown', 'KendallJenner']|thoughts kffiunh wzyq bxhiq wvs kkszkazhfd
159|['KendallJenner', 'chrisbrown']|yup expoi tcu wooo ovspeople stores
160|['KendallJenner', 'chrisbrown']|tune gagjixzo njbbhqj ready rhaxgpwsft kfwnizyunp
161|['KendallJenner', 'chrisbrown']|kendallandkylieforovs wzyq bxhiq ovspeople stores xglqxs
162|['KendallJenner', 'chrisbrown']|obfkit agi gagjixzo njbbhqj dmxab tcj
163|['KendallJenner', 'chrisbrown']|kfwnizyunp kendalljexnner wooo thoughts kffiunh njbbhqj
164|['chrisbrown', 'danieltosh']|wvs kkszkazhfd die thoughts kffiunh jbeex
165|['chrisbrown', 'KendallJenner']|tweet tosh tonight ballerina wife dry
166|['KendallJenner', 'HillaryClinton']|wvs kkszkazhfd stores xglqxs kendallandkylieforovs wzyq
167|['KendallJenner', 'chrisbrown']|great kate mckinnon teach kids financial
168|['KendallJenner', 'chrisbrown']|jbeex stores xglqxs kendallandkylieforovs wzyq bxhiq
169|['KendallJenner', 'chrisbrown']|kendalljexnner wooo nav bxhiq kendallandkylieforovs wzyq
170|['chrisbrown', 'jtimberlake']|obfkit agi ready rhaxgpwsft horses joynerlucas
171|['chrisbrown', 'KendallJenner']|iiqwhhpyqj star theellenshow carsondaly presenting kind
172|['KendallJenner', 'BrunoMars']|fccn obfkit agi nav ovspeople stores
173|['KendallJenner', 'chrisbrown']|xglqxs kendallandkylieforovs wzyq bxhiq love prayers
174|['KendallJenner', 'chrisbrown']|stores xglqxs kendallandkylieforovs wzyq bxhiq tickets
175|['chrisbrown', 'WSJ']|kylie select ovspeople stores xglqxs kendallandkylieforovs
176|['chrisbrown', 'KendallJenner']|kffiunh department won turn sensitive documents
177|['KendallJenner', 'chrisbrown']|mpppg kardashianukfan kendall horses archived kendall
178|['chrisbrown', 'aliciakeys']|oxd joynerlucas jbeex nhb die thoughts
179|['aliciakeys', 'BarackObama']|kffiunh nhb mpppg dont die thoughts
180|['BarackObama', 'KendallJenner']|loyalty home team chmtw important task
181|['KendallJenner', 'chrisbrown']|tune gagjixzo njbbhqj wooo singapore young
182|['KendallJenner', 'chrisbrown']|gagjixzo njbbhqj dmxab tcj kendall kylie
183|['KendallJenner', 'chrisbrown']|gagjixzo njbbhqj kardashianukfan kendall horses rhaxgpwsft
184|['chrisbrown', 'NASA']|iiqwhhpyqj kardashianukfan kendall horses gagjixzo njbbhqj
185|['chrisbrown', 'KendallJenner']|oty jfhhf pwiw plants human tissue
186|['KendallJenner', 'chrisbrown']|dont die thoughts kffiunh enjoy weirdness
187|['KendallJenner', 'chrisbrown']|horses weirdness dmxab tcj archived kffiunh
188|['KendallJenner', 'chrisbrown']|kardashianukfan kendall horses dmxab tcj wzyq
189|['KendallJenner', 'chrisbrown']|kendalljexnner wooo stores xglqxs kendallandkylieforovs wzyq
190|['chrisbrown', 'katyperry']|rhaxgpwsft dmxab tcj archived kfwnizyunp gyrcss
191|['chrisbrown', 'KendallJenner']|heart inclusivity meditationbob thecurafoundation making unitetocure
192|['KendallJenner', 'chrisbrown']|kendall kylie select ovspeople stores xglqxs
193|['KendallJenner', 'chrisbrown']|expoi stores xglqxs kendallandkylieforovs wzyq bxhiq
194|['KendallJenner', 'chrisbrown']|kendall kylie select ovspeople stores xglqxs
195|['chrisbrown', 'voguemagazine']|tickets fccn obfkit agi tune gagjixzo
196|['chrisbrown', 'KendallJenner']|john hughes movies starred eef kawkv
197|['KendallJenner', 'chrisbrown']|bxhiq weirdness dmxab tcj kendall kylie
198|['KendallJenner', 'chrisbrown']|uabum oxd mhiiddeolq tickets fccn obfkit
199|['KendallJenner', 'chrisbrown']|fccn obfkit agi tune gagjixzo njbbhqj
200|['KendallJenner', 'chrisbrown']|agi die thoughts kffiunh heartbreakonafullmoontour tickets
201|['KendallJenner', 'chrisbrown']|gyrcss nav tcu dont die thoughts
202|['chrisbrown', 'WSJ']|xglqxs kendallandkylieforovs wzyq bxhiq joynerlucas jbeex
203|['WSJ', 'Eminem']|millions people federal payroll writes greg
204|['WSJ', 'KendallJenner']|make kids qym kmx phzgg hfnfhc
205|['KendallJenner', 'aliciakeys']|americans didn biio wrt small albeit
206|['KendallJenner', 'chrisbrown']|kendalljexnner wooo expoi ovspeople stores xglqxs
207|['chrisbrown', 'StephenAtHome']|iiqwhhpyqj heartbreakonafullmoontour tickets fccn obfkit agi
208|['chrisbrown', 'KendallJenner']|count move bitch wvs kkszkazhfd heartbreakonafullmoontour
209|['KendallJenner', 'chrisbrown']|kylie select ovspeople stores xglqxs kendallandkylieforovs
210|['KendallJenner', 'chrisbrown']|kfwnizyunp ovspeople stores xglqxs kendallandkylieforovs wzyq
211|['chrisbrown', 'Pink']|gyrcss nav idontdie joynerlucas jbeex rhaxgpwsft
212|['chrisbrown', 'KendallJenner']|mpppg jbeex makes happy ruycdbcylu dont
213|['KendallJenner', 'chrisbrown']|ukeehy tcu fccn obfkit agi oxd
214|['KendallJenner', 'chrisbrown']|uabum oxd heartbreakonafullmoontour tickets fccn obfkit
215|['KendallJenner', 'chrisbrown']|gagjixzo njbbhqj rhaxgpwsft dont die thoughts
216|['KendallJenner', 'chrisbrown']|kendalljexnner wooo kylie select ovspeople stores
217|['KendallJenner', 'chrisbrown']|kendalljexnner wooo uabum oxd wooo nav
218|['KendallJenner', 'chrisbrown']|dont die thoughts kffiunh heartbreakonafullmoontour tickets
219|['KendallJenner', 'chrisbrown']|kffiunh rhaxgpwsft bxhiq idontdie joynerlucas jbeex
220|['KendallJenner', 'chrisbrown']|ready rhaxgpwsft xglqxs kendallandkylieforovs wzyq bxhiq
221|['KendallJenner', 'chrisbrown']|kffiunh agi mpppg archived nav kendall
222|['KendallJenner', 'chrisbrown']|enjoy weirdness dmxab tcj bxhiq die
223|['KendallJenner', 'chrisbrown']|weirdness dmxab tcj dont die thoughts
224|['KendallJenner', 'chrisbrown']|angelkendallj archived kendallandkylieforovs wzyq bxhiq kylie
225|['KendallJenner', 'chrisbrown']|kendallandkylieforovs wzyq bxhiq kardashianukfan kendall horses
226|['KendallJenner', 'chrisbrown']|iiqwhhpyqj fccn obfkit agi mhiiddeolq enjoy
227|['KendallJenner', 'chrisbrown']|gagjixzo njbbhqj thoughts kffiunh nhb iiqwhhpyqj
228|['KendallJenner', 'chrisbrown']|mhiiddeolq ready rhaxgpwsft heartbreakonafullmoontour tickets fccn
229|['chrisbrown', 'nytimes']|archived ukeehy tcu iiqwhhpyqj kffiunh horses
230|['nytimes', 'SportsCenter']|wvs kkszkazhfd academic matters documents released
231|['SportsCenter', 'KendallJenner']|happy giving runs inning qrg rmxbho
232|['KendallJenner', 'chrisbrown']|sctop ryanjahn anozlsexhn return oyyq end
233|['chrisbrown', 'KevinHart4real']|wvs kkszkazhfd ukeehy tcu angelkendallj archived
234|['chrisbrown', 'KendallJenner']|speak refuses listen uxxseigrz tickets whfbycbwj
235|['KendallJenner', 'pitbull']|weirdness dmxab tcj tickets fccn obfkit
236|['KendallJenner', 'chrisbrown']|weirdness dmxab tcj emergeamericas emerge wooo
237|['KendallJenner', 'chrisbrown']|agi obfkit agi select ovspeople stores
238|['chrisbrown', 'SethMacFarlane']|archived tcj oxd archived expoi nav
239|['SethMacFarlane', 'MariahCarey']|imdfu fucking blogs pieces criticisms analyses
240|['SethMacFarlane', 'KendallJenner']|kirk sir znw rtx christ internet
241|['KendallJenner', 'chrisbrown']|lot savagely captain fuckin kirk sir
242|['KendallJenner', 'chrisbrown']|horses stores xglqxs kendallandkylieforovs wzyq bxhiq
243|['KendallJenner', 'chrisbrown']|tune gagjixzo njbbhqj kffiunh dont die
244|['KendallJenner', 'chrisbrown']|archived kardashianukfan kendall horses ovspeople stores
245|['KendallJenner', 'chrisbrown']|idontdie joynerlucas jbeex heartbreakonafullmoontour tickets fccn
246|['chrisbrown', 'Eminem']|kylie select ovspeople stores xglqxs kendallandkylieforovs
247|['chrisbrown', 'KendallJenner']|club coach lla hit site weekend
248|['KendallJenner', 'chrisbrown']|mpppg kardashianukfan kendall horses archived die
249|['KendallJenner', 'chrisbrown']|heartbreakonafullmoontour tickets fccn obfkit agi angelkendallj
250|['KendallJenner', 'chrisbrown']|ready rhaxgpwsft kffiunh kendallandkylieforovs wzyq bxhiq
251|['KendallJenner', 'chrisbrown']|heartbreakonafullmoontour tickets fccn obfkit agi horses
252|['KendallJenner', 'chrisbrown']|archived tickets fccn obfkit agi heartbreakonafullmoontour
253|['KendallJenner', 'chrisbrown']|jbeex expoi heartbreakonafullmoontour tickets fccn obfkit
254|['KendallJenner', 'chrisbrown']|dmxab tcj thoughts kffiunh tcj heartbreakonafullmoontour
255|['KendallJenner', 'chrisbrown']|ready rhaxgpwsft nav tickets fccn obfkit
256|['KendallJenner', 'chrisbrown']|kardashianukfan kendall horses gyrcss nav njbbhqj
257|['chrisbrown', 'nickjonas']|iiqwhhpyqj ready rhaxgpwsft kfwnizyunp thoughts kffiunh
258|['chrisbrown', 'KendallJenner']|couple pieces jvxnj collection case missed
259|['KendallJenner', 'chrisbrown']|kylie select ovspeople stores xglqxs kendallandkylieforovs
260|['KendallJenner', 'chrisbrown']|weirdness dmxab tcj tickets fccn obfkit
261|['chrisbrown', 'KevinHart4real']|gyrcss nav nhb wooo dont die
262|['chrisbrown', 'KendallJenner']|idontdie joynerlucas jbeex thoughts kffiunh business
263|['KendallJenner', 'chrisbrown']|gagjixzo njbbhqj tickets fccn obfkit agi
264|['KendallJenner', 'chrisbrown']|jbeex dmxab tcj gagjixzo njbbhqj wzyq
265|['chrisbrown', 'WSJ']|heartbreakonafullmoontour tickets fccn obfkit agi kendalljexnner
266|['chrisbrown', 'KendallJenner']|guts skip line ntfxd dhwb ntfxd
267|['KendallJenner', 'Zendaya']|tickets fccn obfkit agi die thoughts
268|['KendallJenner', 'chrisbrown']|don wan talk gui ycjo kendallandkylieforovs
269|['KendallJenner', 'chrisbrown']|weirdness dmxab tcj xglqxs kendallandkylieforovs wzyq
270|['KendallJenner', 'chrisbrown']|iiqwhhpyqj gyrcss nav rhaxgpwsft kendallandkylieforovs wzyq
271|['KendallJenner', 'chrisbrown']|kardashianukfan kendall horses idontdie joynerlucas jbeex
272|['chrisbrown', 'HillaryClinton']|dmxab tcj nav joynerlucas jbeex uabum
273|['chrisbrown', 'KendallJenner']|rhaxgpwsft responders girheosjtw fccn obfkit agi
274|['KendallJenner', 'chrisbrown']|oxd bxhiq die thoughts kffiunh bxhiq
275|['KendallJenner', 'chrisbrown']|tcj yup expoi ukeehy tcu agi
276|['chrisbrown', 'KendallJenner']|oxd expoi tickets fccn obfkit agi
277|['chrisbrown', 'KendallJenner']|heartbreakonafullmoontour tickets fccn obfkit agi wzyq
278|['chrisbrown', 'KendallJenner']|mpppg bxhiq iiqwhhpyqj agi bxhiq gagjixzo
279|['chrisbrown', 'KendallJenner']|select ovspeople stores xglqxs kendallandkylieforovs wzyq
280|['chrisbrown', 'KendallJenner']|die thoughts kffiunh wzyq bxhiq tcu
281|['chrisbrown', 'KendallJenner']|weirdness dmxab tcj bxhiq ovspeople stores
282|['chrisbrown', 'KendallJenner']|archived weirdness dmxab tcj mhiiddeolq fccn
283|['KendallJenner', 'jtimberlake']|dont die thoughts kffiunh heartbreakonafullmoontour tickets
284|['KendallJenner', 'chrisbrown']|walkoffame star theellenshow carsondaly presenting kind
285|['chrisbrown', 'KendallJenner']|thoughts kffiunh oxd mhiiddeolq kfwnizyunp ready
286|['chrisbrown', 'KendallJenner']|idontdie joynerlucas jbeex oxd gagjixzo njbbhqj
287|['KendallJenner', 'PlayStation']|tickets fccn obfkit agi expoi agi
288|['KendallJenner', 'chrisbrown']|runs amp tqprshkfmu redemption trailer phkynyf
289|['chrisbrown', 'KendallJenner']|rhaxgpwsft ready rhaxgpwsft agi enjoy weirdness
290|['chrisbrown', 'KendallJenner']|joynerlucas jbeex kendall kylie select ovspeople
291|['KendallJenner', 'JimCarrey']|expoi xglqxs kendallandkylieforovs wzyq bxhiq bxhiq
292|['KendallJenner', 'chrisbrown']|bxhiq horses whrazjb inwardly ravenous wolves
293|['chrisbrown', 'KendallJenner']|joynerlucas jbeex jbeex jbeex archived tickets
294|['chrisbrown', 'KendallJenner']|stores xglqxs kendallandkylieforovs wzyq bxhiq kendall
295|['chrisbrown', 'KendallJenner']|oxd weirdness dmxab tcj dmxab tcj
296|['chrisbrown', 'KendallJenner']|jbeex tune gagjixzo njbbhqj nhb nhb
297|['chrisbrown', 'KendallJenner']|angelkendallj archived obfkit agi xglqxs kendallandkylieforovs
298|['chrisbrown', 'KendallJenner']|enjoy weirdness dmxab tcj nhb agi
299|['KendallJenner', 'chrisbrown']|kfwnizyunp ukeehy tcu gyrcss nav angelkendallj
300|['KendallJenner', 'chrisbrown']|gagjixzo njbbhqj dont die thoughts kffiunh
301|['KendallJenner', 'chrisbrown']|xglqxs kendallandkylieforovs wzyq bxhiq select ovspeople
302|['KendallJenner', 'chrisbrown']|rhaxgpwsft yup expoi tcj tcu die
303|['KendallJenner', 'chrisbrown']|wvs kkszkazhfd xglqxs kendallandkylieforovs wzyq bxhiq
304|['KendallJenner', 'chrisbrown']|rhaxgpwsft gagjixzo njbbhqj die thoughts kffiunh
305|['KendallJenner', 'chrisbrown']|archived weirdness dmxab tcj stores xglqxs
306|['chrisbrown', 'danieltosh']|archived mhiiddeolq ready rhaxgpwsft stores xglqxs
307|['chrisbrown', 'KendallJenner']|jokes mock people appearance crazy fat
308|['chrisbrown', 'KendallJenner']|tcu fccn obfkit agi idontdie joynerlucas
309|['chrisbrown', 'KendallJenner']|die thoughts kffiunh heartbreakonafullmoontour tickets fccn
310|['chrisbrown', 'KendallJenner']|oxd kendall kylie select ovspeople stores
311|['chrisbrown', 'KendallJenner']|kendallandkylieforovs wzyq bxhiq yup expoi horses
312|['chrisbrown', 'KendallJenner']|wzyq bxhiq fccn obfkit agi mhiiddeolq
313|['chrisbrown', 'KendallJenner']|dont die thoughts kffiunh nhb gyrcss
314|['chrisbrown', 'KendallJenner']|nhb die thoughts kffiunh wooo rhaxgpwsft
315|['chrisbrown', 'KendallJenner']|nav iiqwhhpyqj thoughts kffiunh yup expoi
316|['KendallJenner', 'Beyonce']|horses gagjixzo njbbhqj nav dmxab tcj
317|['Beyonce', 'LeoDiCaprio']|archived visual album jownke dug expoi
